,이름,채널ID,동영상ID,제목,조회수,좋아요수,댓글수
164,Hongyu ASMR 홍유,UCxtLc0Jqq3SKBWlIXM_OC9g,pF47J7wAv6E,"ASMR RAW SEAFOOD MUKBANG 전어회, 새우회, 연어회, 바다포도 먹방 RAW SALMON, SHRIMP,  SEA GRAPES EATING SOUNDS KOREAN",1220127,19413,324
165,Hongyu ASMR 홍유,UCxtLc0Jqq3SKBWlIXM_OC9g,J5z6jBskj9w,ASMR WATERMELON DESSERTS *EDIBLE TOWEL PURPLE DRINKS SEA GRAPES GREEN TEA 수박 디저트 먹는 수건 젤리 먹방 MUKBANG,421184,5667,182
166,Hongyu ASMR 홍유,UCxtLc0Jqq3SKBWlIXM_OC9g,nhJP7B3ICbM,ASMR RAINBOW DESSERTS FROZEN NIK-L-NIP FRUITS KOHAKUTO 무지개 디저트 코하쿠토 얼린 닉클립 먹방 EATING SOUNDS MUKBANG,4587190,23361,466
167,Hongyu ASMR 홍유,UCxtLc0Jqq3SKBWlIXM_OC9g,GJT60MVK6PI,"ASMR PINK DRINKS, RAINBOW CREPE CAKE, HONEY COMB KOHAKUTO 핑크색 디저트 무지개 크레이프 벌꿀집 코하쿠토 꿀젤리 먹방 MUKBANG",2872755,20164,502
168,Hongyu ASMR 홍유,UCxtLc0Jqq3SKBWlIXM_OC9g,6bkZQ2GgDVA,"ASMR SPICY SEAFOOD MUKBANG 불닭 해물찜, 팽이버섯 먹방 ENOKI MUSHROOMS OCTOPUS SHRIMP CRAB EATING&amp;COOKING SOUNDS",1220939,18194,265
169,Hongyu ASMR 홍유,UCxtLc0Jqq3SKBWlIXM_OC9g,W0KoFUDV4Tw,ASMR RAINBOW DESSERTS KOHAKUTO 신기한 무지개 먹방 SPOONS BOBA GUMMY MACARON JELLY DRINKING SOUNDS MUKBANG,2801789,13958,370
170,Hongyu ASMR 홍유,UCxtLc0Jqq3SKBWlIXM_OC9g,ZNo9u_0g8qk,ASMR RAINBOW DESSERTS KOHAKUTO WATERMELON TANGHULU JELLY 무지개 디저트 수박 탕후루 레인보우 젤리 구미 EATING MUKBANG 먹방,1639973,10000,244
171,Hongyu ASMR 홍유,UCxtLc0Jqq3SKBWlIXM_OC9g,Ohkw_jqCa-I,ASMR DEACHANG KIMCHI MUKBANG 바삭한 통대창 쪽파김치 먹방 GRILLED BEEF LARGE INTESTINES COOKING &amp; EATING KOREAN,6063347,69231,1633
172,Hongyu ASMR 홍유,UCxtLc0Jqq3SKBWlIXM_OC9g,3kAmpkGgW0Y,"ASMR RAINBOW DESSERTS KOHAKUTO BOBA GUMMY 무지개 디저트, 과일 코하쿠토, 레인보우 크레이프 케이크 먹방 DRINKING SOUNDS MUKBANG",13476869,44298,520
173,Hongyu ASMR 홍유,UCxtLc0Jqq3SKBWlIXM_OC9g,FdRu2OID-D8,ASMR EXOTIC FRUITS SOUR LEMON 다양 과일 먹방 MANGOSTEEN STRAWBERRY CHERRY KIWI ORANGE 레몬 라임 망고스틴 딸기MUKBANG,5547445,29579,544
174,Hongyu ASMR 홍유,UCxtLc0Jqq3SKBWlIXM_OC9g,koszKv327L4,"ASMR RAINBOW KOHAKUTO, FROZEN NIK-L-NIP, UNICORN STRAWBERRY 무지개 코하쿠토, 얼린 닉클립 젤리 DESSERTS MUKBANG 먹방",4875624,25382,500
175,Hongyu ASMR 홍유,UCxtLc0Jqq3SKBWlIXM_OC9g,gAodULZYrFg,ASMR RAINBOW DESSERTS 신기한 무지개 디저트 KOHAKUTO NIK-L-NIP WAX STICKS EYEBALL GUMMY 레인보우 음식 먹방 MUKBANG,2981720,17050,361
176,Hongyu ASMR 홍유,UCxtLc0Jqq3SKBWlIXM_OC9g,-Z95T6fnYuE,"ASMR BLACK BEAN ENOKI MUSHROOM, TRUFFLE BLACK BEAN NOODLES 짜장 팽이버섯, 트러플짜파게티 EATING SOUNDS 먹방 MUKBANG",976646,16496,327
177,Hongyu ASMR 홍유,UCxtLc0Jqq3SKBWlIXM_OC9g,iClHqPMVBms,ASMR BLUE DESSERTS 파란색 디저트 신기한 음식 먹방 BOBA LEGO GALAXY KOHAKUTO JELLY GUMMY COLOR FOOD EATING SOUNDS,1086406,11401,326
178,Hongyu ASMR 홍유,UCxtLc0Jqq3SKBWlIXM_OC9g,NihNidGR-yk,ASMR DEACHANG MUKBANG 육즙팡팡 통대창 파김치 꿀조합먹방 GRILLED BEEF LARGE INTESTINES COOKING&amp;EATING SOUNDS MUKBANG,1761763,26670,638
179,Hongyu ASMR 홍유,UCxtLc0Jqq3SKBWlIXM_OC9g,ASdZflUmvGQ,"ASMR RAINBOW FRUIT RICE CAKE 과일 화과자, 틱톡 젤리 RAINBOW DESSERTS TIK TOK JELLY NOODLES EATING 먹방 MUKBANG",993843,9725,257
180,Hongyu ASMR 홍유,UCxtLc0Jqq3SKBWlIXM_OC9g,XdGOcKYU4SI,ASMR RAINBOW DESSERTS 신기한 무지개 디저트 KOHAKUTO POP RAINBOW STRAWBERRY MACARONS JELLY 레인보우 음식 먹방 MUKBANG,5874574,28278,573
181,Hongyu ASMR 홍유,UCxtLc0Jqq3SKBWlIXM_OC9g,lyOEp6lQqw4,"ASMR SPICY SEAFOOD HOT POT 마라탕 뉴진면 먹방 OCTOPUS, ENOKI MUSHROOM MALATANG COOKING&amp;EATING SOUNDS MUKBANG",1298706,22145,420
182,Hongyu ASMR 홍유,UCxtLc0Jqq3SKBWlIXM_OC9g,lSAQL88xXs0,ASMR RAINBOW DESSERTS 신기한 무지개 디저트 KOHAKUTO EYE GUMMY POPPING BOBA POP IT JELLY 레인보우 음식 먹방 MUKBANG,7191775,28612,525
183,Hongyu ASMR 홍유,UCxtLc0Jqq3SKBWlIXM_OC9g,XYScyXbZzFo,"ASMR RAW SEAFOOD *RAW SHRIMP* 생새우 먹방 SEA GRAPES, SHRIPM SUSHI  EATING SOUNDS MUKBANG KOREAN 바다포도 해산물",1057371,20434,399
184,Hongyu ASMR 홍유,UCxtLc0Jqq3SKBWlIXM_OC9g,ZqatSbn4YEc,ASMR RAINBOW DESSERTS 신기한 무지개 디저트 KOHAKUTO POPPING BOBA EDIBLE SPOON MARSHMALLOW 레인보우 음식 먹방 MUKBANG,13148846,45013,604
185,Hongyu ASMR 홍유,UCxtLc0Jqq3SKBWlIXM_OC9g,mcwBwU-fqug,"ASMR RAINBOW DESSERTS KOHAKUTO, EXOTIC FRUITS, COLOR CANDY 무지개 오리 코하쿠토 다양 과일 레인보우 젤리 마카롱 MUKBANG 먹방",2010955,13018,305
186,Hongyu ASMR 홍유,UCxtLc0Jqq3SKBWlIXM_OC9g,G-9YOkJBW2s,"ASMR FIRE NOODLES 뉴진면, 불닭팽이버섯, 낙지 SPICY OCTOPUS ENOKI MUSHROOM COOKING&amp;EATING SOUNDS SEAFOOD MUKBANG",929123,17463,468
187,Hongyu ASMR 홍유,UCxtLc0Jqq3SKBWlIXM_OC9g,HR6mCyystLg,"ASMR RAINBOW JELLY, ROLY-POLY-TOY, COTTON CANDY, GUMMY SNACK 레인보우 젤리, 롤리폴리토이, 햄버거젤리, 무지개 먹방 MUKBANG",4725846,22848,418
188,Hongyu ASMR 홍유,UCxtLc0Jqq3SKBWlIXM_OC9g,f2AZC5d-png,ASMR RAINBOW DESSERTS POPPING BOBA KOHAKUTO 무지개 디저트 팝핑보바 레인보우 젤리국수 JELLY EATING SOUNDS MUKBANG 먹방,2612676,15509,352
189,Hongyu ASMR 홍유,UCxtLc0Jqq3SKBWlIXM_OC9g,4zcq_W_cOBg,ASMR RAW SEAFOOD *GIZZARD SHAD* 통전어회 먹방 EATING SOUNDS MUKBANG KOREAN  コノシロ 가을전어 해산물,1620221,21704,572
190,Hongyu ASMR 홍유,UCxtLc0Jqq3SKBWlIXM_OC9g,LDv5yS2nqrQ,"ASMR RAINBOW BUTTON CANDY, FRUIT RICE CAKE, GALAXY JELLY 무지개 먹방 레인보우 디저트 화과자 EATING SOUNDS MUKBANG",1315237,9785,240
191,Hongyu ASMR 홍유,UCxtLc0Jqq3SKBWlIXM_OC9g,wgXZx17VKtY,ASMR RAINBOW DESSERTS 신기한 무지개 개구리 FROG EGGS POPPING BOBA BIRD GLASS WATER DRINKING SOUNDS 먹방 MUKBANG,572456,6709,198
192,Hongyu ASMR 홍유,UCxtLc0Jqq3SKBWlIXM_OC9g,5rgG963KhZ8,"ASMR BLACK BEAN NOODLES SPICY ENOKI MUSHROOMS CHICKEN 불닭 팽이버섯 양념치킨, 트러플짜파게티 먹방 EATING SOUNDS MUKBANG",972353,18260,364
193,Hongyu ASMR 홍유,UCxtLc0Jqq3SKBWlIXM_OC9g,yEqshMv987o,"ASMR RAINBOW JELLO SHOOTER, POP IT, KOHAKUTO 무지개 젤로슈터, 레인보우 팝잇, 푸쉬팝, 바삭한 젤리 EATING SOUNDS 먹방 MUKBANG",1648752,11150,266
194,Hongyu ASMR 홍유,UCxtLc0Jqq3SKBWlIXM_OC9g,lS7XQpSu1hQ,ASMR PURPLE DESSERTS 보라색 디저트 먹방 EDIBLE LEGO KOHAKUTO GRAPE JELLY CAKE MARSHMALLOW EATING MUKBANG,731830,9885,256
195,Hongyu ASMR 홍유,UCxtLc0Jqq3SKBWlIXM_OC9g,VHta-levkGA,ASMR RAINBOW STRAWBERRY KOHAKUTO EYEBALL GUMMY ICE CREAM JELLY MACARONS MARSHMALLOW 무지개 음식먹방 MUKBANG,11287298,39752,546
196,Hongyu ASMR 홍유,UCxtLc0Jqq3SKBWlIXM_OC9g,U6-qfQxUuqw,"ASMR DEACHANG MUKBANG 통대창 먹방 GRILLED BEEF LARGE INTESTINES, SPICY FIRE SAUCE COOKING&amp;EATING KOREAN",4356026,54627,1121
197,Hongyu ASMR 홍유,UCxtLc0Jqq3SKBWlIXM_OC9g,GFz-Hr1e80g,ASMR RAINBOW DESSERTS KOHAKUTO TIKTOK JELLY OREO SNACK FRUITS GUMMY JELLY 무지개 디저트 코하쿠토 MUKBANG 먹방,2478731,16032,392
198,Hongyu ASMR 홍유,UCxtLc0Jqq3SKBWlIXM_OC9g,IAjqq7xUXic,ASMR WATERMELON DESSERTS 수박 디저트 FRUITS RICE CAKE KOHAKUTO JELLY MACARONS 수박 화과자 수박젤리 마카롱 MUKBANG 먹방,1511416,12228,302
199,Hongyu ASMR 홍유,UCxtLc0Jqq3SKBWlIXM_OC9g,gD6kCChhpXM,"ASMR RAINBOW DESSERTS KOHAKUTO SNACK JELLY 무지개 디저트, 과일 코하쿠토, 초발젤리, 레인보우 젤리 먹방 EATING SOUNDS MUKBANG",1490854,12051,282
200,[햄지]Hamzy,UCPKNKldggioffXPkSmjs5lQ,vtwHpH7d6KY,Real Mukbang:) I launched a meal kits! ☆ boiled beef Shank and Tender &amp; Stir-fried Yeomtong Tender,578980,17067,725
201,[햄지]Hamzy,UCPKNKldggioffXPkSmjs5lQ,E8-W4MP8Gc8,Do you want a bite? #shorts #OctopusSoup,75960,3491,44
202,[햄지]Hamzy,UCPKNKldggioffXPkSmjs5lQ,HCYbJoSZN-0,Mukbang behind the scenes #shorts #NG,292132,8968,134
203,[햄지]Hamzy,UCPKNKldggioffXPkSmjs5lQ,gGKR-wFtKvg,Real mukbang:) Huge Snow crab ☆ Snow crab intestine fried rice &amp; snow crab ramyunㅣ어서오시게,1752176,33964,852
204,[햄지]Hamzy,UCPKNKldggioffXPkSmjs5lQ,XwaLk8aZwK8,Do you want a bite? #오늘통닭 #shorts,161608,7276,57
205,[햄지]Hamzy,UCPKNKldggioffXPkSmjs5lQ,FYdH0R1gv1I,Do you like this? #shorts,178732,6330,88
206,[햄지]Hamzy,UCPKNKldggioffXPkSmjs5lQ,IUrsbGbRUWU,Real Mukbang:) Look at this giant octopus. A spicy Yeonpotang ☆ Roasted Sweet Potato and kimchiㅣ해남군,847518,19653,665
207,[햄지]Hamzy,UCPKNKldggioffXPkSmjs5lQ,InU4Y0NwdGs,Would you like this? #shorts,124598,5937,47
208,[햄지]Hamzy,UCPKNKldggioffXPkSmjs5lQ,aaJeqXyejnw,"Real mukbang:)  Chicken and beer 🍺 spicy korean sea snail salad,  soupy tteokbokkiㅣ오늘통닭",2631917,41638,1031
209,[햄지]Hamzy,UCPKNKldggioffXPkSmjs5lQ,h2VWeZFEyoE,Do you want a bite? #shorts,388235,16685,162
210,[햄지]Hamzy,UCPKNKldggioffXPkSmjs5lQ,Xfnd8HwxjZ0,Real Mukbang:) Try this if you have only eggs in your fridge!😍 Stir-fried Kimchi Recipe 🍳,1096934,24109,665
211,[햄지]Hamzy,UCPKNKldggioffXPkSmjs5lQ,lUu9u0eBOrc,Do you want a bite? #shorts,388194,20680,152
212,[햄지]Hamzy,UCPKNKldggioffXPkSmjs5lQ,bMGTKkM_QqY,Real Mukbang:) Dakgalbi is a warming up to eat fried rice. ☆Korean Cheese fried rice,1954917,35300,745
213,[햄지]Hamzy,UCPKNKldggioffXPkSmjs5lQ,pAoCEB2tK60,Do you want a bite? #shorts,367178,15022,93
214,[햄지]Hamzy,UCPKNKldggioffXPkSmjs5lQ,we8oMmCQ28Q,Do you want to join us? #shorts,280652,9733,127
215,[햄지]Hamzy,UCPKNKldggioffXPkSmjs5lQ,9vb198_BGhY,Real Mukbang:) Yangpoon Bibimbap will bring your appetite back★ Chadol Soybean Paste Stew ☺,1684700,33675,784
216,[햄지]Hamzy,UCPKNKldggioffXPkSmjs5lQ,2ns6AD8qSoM,Do you want to join us? #shorts,273296,10848,135
217,[햄지]Hamzy,UCPKNKldggioffXPkSmjs5lQ,I8fUnf8W0BI,Real Mukbang:) Spicy Yeopgi Tteokbokki !! Put whatever I want!★ Dessert is Shine Muscat🍇,2676179,47032,847
218,[햄지]Hamzy,UCPKNKldggioffXPkSmjs5lQ,Ql9s5PMHNbg,Soy marinated raw crab &amp; Spicy raw crab 🦀 #shorts,196092,7497,69
219,[햄지]Hamzy,UCPKNKldggioffXPkSmjs5lQ,XFRgobeAokM,"Real Mukbang:) Tuna Kimchi Jjigae, Fish Cutlet☆Delicious Home Meal",2189662,37316,838
220,[햄지]Hamzy,UCPKNKldggioffXPkSmjs5lQ,-4WjP-Q7CWA,Hot &amp; Spicy Yukgaejang Noodle Soup 🍜 #shorts,239407,9380,59
221,[햄지]Hamzy,UCPKNKldggioffXPkSmjs5lQ,dPYREVBmHGg,Rice in ice water? #shorts #kimchi #spicyfood,326734,9406,174
222,[햄지]Hamzy,UCPKNKldggioffXPkSmjs5lQ,xs6UVpISs8Q,"Real Mukbang:) I Cannot Choose Only One, Soy marinated raw crab &amp; Spicy raw crabㅣ봉선장간장게장",2541666,41580,825
223,[햄지]Hamzy,UCPKNKldggioffXPkSmjs5lQ,gi2-QPJgwQg,Do you want a bite? #shorts #porkbelly,200260,8816,77
224,[햄지]Hamzy,UCPKNKldggioffXPkSmjs5lQ,M-mB0Nvre70,Do you want a bite? #shorts #Koreanmelon,503906,15755,438
225,[햄지]Hamzy,UCPKNKldggioffXPkSmjs5lQ,dsxB9MH3yK8,Real Mukbang:) Hearty Yukgaejang Kalguksu☆Mango to FinishㅣYukgaejang KalguksuㅣReal Mukbangㅣ하림육개장칼국수,1785640,34097,1061
226,[햄지]Hamzy,UCPKNKldggioffXPkSmjs5lQ,eDkEj5kJdZI,Do you want a bite? #shorts #rice #SaltedSeafood,331115,11670,98
227,[햄지]Hamzy,UCPKNKldggioffXPkSmjs5lQ,5T068SQoPT4,Real Mukbang:) Grilling Spicy Kimchi with Pork Belly Fat ☆ Fried Rice to FinishㅣPork Belly Fat,1596647,33010,745
228,[햄지]Hamzy,UCPKNKldggioffXPkSmjs5lQ,iJxOavMMKj0,Do you want a bite? #shorts #koreanchicken #spicynoodles,513723,13662,143
229,[햄지]Hamzy,UCPKNKldggioffXPkSmjs5lQ,Fp8yDScdO6I,Do you want a bite? #shorts #Grilledbeefintestinse,254269,9425,53
230,[햄지]Hamzy,UCPKNKldggioffXPkSmjs5lQ,NmGUe0Jvj3Y,"어리굴젓,낙지젓갈 솥밥에 올려먹기(ft.누룽지)☆디저트는 참외ㅣPressure Cooker RiceㅣReal Mukbangㅣ",1677746,30081,967
231,[햄지]Hamzy,UCPKNKldggioffXPkSmjs5lQ,d3mjPGl0_y4,Do you want a bite? #shorts #Spicyoctopus #BeefIntestine,278391,10641,90
232,[햄지]Hamzy,UCPKNKldggioffXPkSmjs5lQ,lMg-fjtU7YM,Do you want a bite? #shorts #pineapple,295821,11067,91
233,[햄지]Hamzy,UCPKNKldggioffXPkSmjs5lQ,qh93NlN9ctE,닭껍질 먹으려고 통닭먹어요...☆쫄면이랑 환상궁합ㅣCrispy ChickenㅣReal Mukbangㅣ,3367040,52370,1209
234,[햄지]Hamzy,UCPKNKldggioffXPkSmjs5lQ,h4DwkUVS47Y,Do you want a bite? #shorts #koreanpancake,301387,8751,101
235,[햄지]Hamzy,UCPKNKldggioffXPkSmjs5lQ,xD2W-aOOAl8,"매운쭈꾸미에 대창,곱창 들어가면 얼마나 맛있게요?ㅣSpicy octopus &amp; Beef IntestineㅣReal Mukbangㅣ",1913889,33741,752
236,[햄지]Hamzy,UCPKNKldggioffXPkSmjs5lQ,R8p5sdtQX3s,Do you want a bite? #shorts #MaraXiangguo,278656,10418,80
237,[햄지]Hamzy,UCPKNKldggioffXPkSmjs5lQ,eNo4895h7RA,Do you want a bite? #shorts #kimchi #spicyfood,591046,15927,222
238,[햄지]Hamzy,UCPKNKldggioffXPkSmjs5lQ,Hsa70dVugJc,"얼음물에 밥 말아도 놀라지 마세요 (ft.습습실비김치,통스팸,계란후라이)ㅣSpicy KimchiㅣReal Mukbangㅣ",2217405,36516,1173
239,[햄지]Hamzy,UCPKNKldggioffXPkSmjs5lQ,ntAiGGeGsms,Do you want a bite? #shorts #KoreanChicken,236468,9199,70
240,[햄지]Hamzy,UCPKNKldggioffXPkSmjs5lQ,9LPSHqce5_Q,Do you want a bite? #shorts #BraisedSpicyChicken,195315,9222,79
241,[햄지]Hamzy,UCPKNKldggioffXPkSmjs5lQ,EKTlTEy-iMk,마랴샹궈엔 연태고량주👍(ft.크림새우)ㅣMara XiangguoㅣReal Mukbangㅣ,1839928,30984,843
242,[햄지]Hamzy,UCPKNKldggioffXPkSmjs5lQ,50FzaFdyXUY,Do you want a bite? #shorts #ramyun,312373,10833,95
243,[햄지]Hamzy,UCPKNKldggioffXPkSmjs5lQ,GXwwyLCTtaY,Do you want a bite? #shorts #orange,481937,10349,172
244,[햄지]Hamzy,UCPKNKldggioffXPkSmjs5lQ,WdQasO9pSIk,닭도리탕 때깔보소...☆베이컨감자채전 ㅣDakdoritangㅣReal Mukbangㅣ,3766194,56089,1160
245,[햄지]Hamzy,UCPKNKldggioffXPkSmjs5lQ,or6sJqOzedw,Do you want a bite? #shorts #Ducksoup,226311,7758,120
246,[햄지]Hamzy,UCPKNKldggioffXPkSmjs5lQ,HML3FrfBzQQ,Do you want a bite? #shorts #Grilledbeefintestine,582241,10392,251
247,[햄지]Hamzy,UCPKNKldggioffXPkSmjs5lQ,LFVjKiuO7QU,"짜장라면 더 맛있게 만드는 방법 (ft.군만두,파김치)ㅣJjajang RamyunㅣReal Mukbangㅣ",3112656,57791,792
248,[햄지]Hamzy,UCPKNKldggioffXPkSmjs5lQ,pQsOBsa-kf0,Do you want a bite? #shorts #octopus,164413,5892,44
249,[햄지]Hamzy,UCPKNKldggioffXPkSmjs5lQ,kyVlqzExnmo,Do you want a bite? #shorts #KoreanBraisedChicken,337152,11661,106
250,[햄지]Hamzy,UCPKNKldggioffXPkSmjs5lQ,d9LsYYY7nIA,감자탕 만들기 차~암 쉽죠?ㅣGamjatangㅣReal Mukbangㅣ,2508691,37533,915
251,[햄지]Hamzy,UCPKNKldggioffXPkSmjs5lQ,u_sn6f30k1o,Do you want a bite? #shorts #GrilledBeefIntestines,332626,11205,87
252,[햄지]Hamzy,UCPKNKldggioffXPkSmjs5lQ,OWBhQlyn6y8,1kg 돌문어🐙 문어숙회 &amp; 문어라면ㅣBoiled OctopusㅣReal Mukbangㅣ,1395027,28168,705
253,[햄지]Hamzy,UCPKNKldggioffXPkSmjs5lQ,7-8OkgbXGog,Do you want a bite? #shorts #BraisedSpicyCodFish,346609,12769,102
254,[햄지]Hamzy,UCPKNKldggioffXPkSmjs5lQ,P_CeMpHYvLw,"대창1kg 구우면 기름이 이만큼 나와요... (ft.불닭볶음면,레드향)ㅣGrilled Beef IntestinesㅣReal Mukbang 리얼먹방ㅣ",1995114,34792,826
255,[햄지]Hamzy,UCPKNKldggioffXPkSmjs5lQ,ZD03dnmELtg,Do you want a bite? #shorts #Ssambap #bulgogi,295437,11446,104
256,[햄지]Hamzy,UCPKNKldggioffXPkSmjs5lQ,A_Y9RNd_D6Y,매운 아귀찜이 땡기는 날...ㅣAgwijjimㅣReal Mukbang 리얼먹방ㅣ,2376787,38650,869
257,[햄지]Hamzy,UCPKNKldggioffXPkSmjs5lQ,wuNTmwE6PN4,Do you want a bite? #shorts #BackRibs,413419,13865,99
258,[햄지]Hamzy,UCPKNKldggioffXPkSmjs5lQ,O6eHnzfDvFM,우렁쌈밥&amp;제육볶음 쌈밥정식!! 한국인의 집밥ㅣSsambapㅣReal Mukbang 리얼먹방ㅣ,2677056,43817,954
259,[햄지]Hamzy,UCPKNKldggioffXPkSmjs5lQ,sNNdxjpV_Bo,매운 치즈등갈비 위에 청양고추ㅣSpicy Cheese Back RibsㅣReal Mukbang 리얼먹방ㅣ,2058591,33278,924
260,[햄지]Hamzy,UCPKNKldggioffXPkSmjs5lQ,IyAjyWpDjNw,Do you want a bite? #shorts #PorkBelly #kimchi,755722,13645,165
261,[햄지]Hamzy,UCPKNKldggioffXPkSmjs5lQ,sbxZ0U3uJI0,Do you want a bite? #shorts #tteokbokki,1047821,42874,226
262,[햄지]Hamzy,UCPKNKldggioffXPkSmjs5lQ,2ZPM8g_4lHE,외국인들은 이해 못하는 펄펄 끓는 순두부찌개 먹방ㅣSundubu-jjigaeㅣReal Mukbang 리얼먹방ㅣ,1988666,34215,1083
263,[햄지]Hamzy,UCPKNKldggioffXPkSmjs5lQ,u-eoQq5hicY,대패삼겹살 기름에 구운 김치와 팽이버섯(ft.원소주)ㅣPork Belly &amp; KimchiㅣReal Mukbang 리얼먹방ㅣ,2294109,37766,982
264,[햄지]Hamzy,UCPKNKldggioffXPkSmjs5lQ,lJ5ii1nahBs,Do you want a bite? #shorts #kimchijjim,447503,12045,131
265,[햄지]Hamzy,UCPKNKldggioffXPkSmjs5lQ,avQVUhK2rzM,"너무 쫄깃한 수타 짜장면!! (ft.탕수육,킹스베리딸기)ㅣJajangmyun &amp; TangsuyukㅣReal Mukbang 리얼먹방ㅣ",3292929,52640,1095
266,[햄지]Hamzy,UCPKNKldggioffXPkSmjs5lQ,Gg1Qh4tBFcM,해킹당해도 김치찜은 잘 넘어가네요(?)ㅣKimchi Pork-JjimㅣReal Mukbang 리얼먹방ㅣ,1381992,28128,942
267,[햄지]Hamzy,UCPKNKldggioffXPkSmjs5lQ,9R7VaRzc3z0,뚝배기 돼지갈비찜 차~암 쉽죠?ㅣDwaeji-galbiㅣReal Mukbang 리얼먹방ㅣ,1552778,28763,923
268,[햄지]Hamzy,UCPKNKldggioffXPkSmjs5lQ,zankrexPbVA,치킨 먹는거 훔쳐보기...초심을 찾아서ㅣKorean Chicken &amp; BeerㅣReal Mukbang 리얼먹방ㅣ,2320813,41996,1517
269,[햄지]Hamzy,UCPKNKldggioffXPkSmjs5lQ,T5HYfHxm4aA,Do you want a bite? #Shorts #galbi,436726,9600,76
270,[햄지]Hamzy,UCPKNKldggioffXPkSmjs5lQ,vK0czAW8vkU,LA갈비 숯불구이! 양념 없이 구워도 맛있어요ㅣLA Galbi charcoal grilledㅣReal Mukbang 리얼먹방ㅣ,870394,19699,1000
271,[햄지]Hamzy,UCPKNKldggioffXPkSmjs5lQ,h-qDBIpHm1s,Do you want a bite? #Shorts #bibimbap,751673,20291,253
272,[햄지]Hamzy,UCPKNKldggioffXPkSmjs5lQ,NV8blITjaSk,무가 제일 맛있는 겨울...무생채 비빔밥과 대패삼겹 된장찌개ㅣBibimbapㅣReal Mukbang 리얼먹방ㅣ,2533991,41106,2318
273,[햄지]Hamzy,UCPKNKldggioffXPkSmjs5lQ,bsTjZJ1zLp4,다이어트는 무슨...겨울엔 역시 굴라면ㅣOyster RamyeonㅣReal Mukbang 리얼먹방ㅣ,2160844,42324,2431
274,[햄지]Hamzy,UCPKNKldggioffXPkSmjs5lQ,hXIIDvF9_1U,리얼먹방:) 한돈&quot;목살스테이크&quot;만들기★고추장 로제파스타ㅣGochujang rose pasta &amp; Pork Neck SteakㅣMUKBANGㅣ,3078322,50224,1783
275,[햄지]Hamzy,UCPKNKldggioffXPkSmjs5lQ,gplgSN2-lNw,리얼먹방:) 자기 전에 보는 햄지&#39;s 요리모음 8탄!!ㅣHAMZY’s Cooking compilations part 8,3260103,32767,744
276,[햄지]Hamzy,UCPKNKldggioffXPkSmjs5lQ,9UpXmFWiF2A,"리얼먹방:) 고추장 닭불고기(?) 만들기★ft.동치미,계란말이ㅣSpicy Chicken BulgogiㅣMUKBANGㅣ",3572465,51839,1155
277,[햄지]Hamzy,UCPKNKldggioffXPkSmjs5lQ,MqlU6uDcHo4,리얼먹방:) 햄지네 산채비빔밥👍★냉콩나물국 레시피ㅣFresh BibimbabㅣMUKBANGㅣ,2168738,35467,936
278,[햄지]Hamzy,UCPKNKldggioffXPkSmjs5lQ,ezvpAddikDk,리얼먹방:) 경양식 돈까스&amp;배추 겉절이 만들기★돈까스 먹방ㅣFresh Kimchi &amp; Tonkatsu (Pork Cutlet)ㅣMUKBANGㅣ,2974031,43037,1105
279,[햄지]Hamzy,UCPKNKldggioffXPkSmjs5lQ,VhxXhJJRuPM,리얼먹방:) 돼지고기 감자 짜글이 만들기★바삭한 감자전ㅣJjageuli (Pork &amp; Potato Stew)ㅣMUKBANGㅣ,2892666,42497,977
280,[햄지]Hamzy,UCPKNKldggioffXPkSmjs5lQ,lnnOG_6OYbQ,리얼먹방:) 오랜만에 말아본 김밥&amp;라볶이★김밥천국st 분식먹방!! ㅣGimbap &amp; Tteokbokki with ramyunㅣMUKBANGㅣ,3936621,54229,1047
281,[햄지]Hamzy,UCPKNKldggioffXPkSmjs5lQ,-La0MvFU3Q0,리얼먹방:) 홍루이젠 샌드위치 디저트 먹방★밀크티&amp;애플사이다ㅣSandwich &amp; Milk teaㅣMUKBANGㅣ,1893099,34703,1093
282,[햄지]Hamzy,UCPKNKldggioffXPkSmjs5lQ,I1lx4yMxGxI,"리얼먹방:) 뜨끈~한 뚝배기 순대국밥&amp; 모듬수육★부추무침,갓김치,배추김치ㅣSundae-GukbapㅣMUKBANGㅣ",2075683,31922,978
283,[햄지]Hamzy,UCPKNKldggioffXPkSmjs5lQ,km3unrIAce0,리얼먹방:) 곱창 비주얼 보소...★ 곱이 가득!! 곱창구이에 소주한잔ㅣGopchang (Grilled beef intestine) &amp; SojuㅣMUKBANGㅣ,1921072,34144,867
284,[햄지]Hamzy,UCPKNKldggioffXPkSmjs5lQ,5XyusyGbMPU,리얼먹방:) 매콤 스지(소힘줄)찜에 소주한잔★쫀득쫀득 너무 맛있어😲ㅣSpicy Braised Beef String with Soju ㅣMUKBANGㅣ,2401139,38384,999
285,[햄지]Hamzy,UCPKNKldggioffXPkSmjs5lQ,VwEgD87M9qw,리얼먹방:) 생굴 무침 &amp; 콜라 삼겹살 수육!! ★ ft.쌈채소ㅣSpicy Oyster &amp; Samgyeopsal SuyukㅣMUKBANGㅣ,2718053,45617,1314
286,[햄지]Hamzy,UCPKNKldggioffXPkSmjs5lQ,pXB8lv4eTRg,"리얼먹방:) 해삼내장 고노와다 비빔밥😲★ft.바지락된장찌개,가자미구이,갈치구이ㅣBibimbab with Sea Cucumber☆ Grilled FishㅣMUKBANGㅣ",1697869,32000,680
287,[햄지]Hamzy,UCPKNKldggioffXPkSmjs5lQ,gWetXZA9v98,"리얼먹방:) 대패삼겹두루치기....이거 완전 밥도둑★ft.들기름두부구이,볶음밥ㅣSpicy Stir-fried Thin Pork BellyㅣMUKBANGㅣ",2130178,36632,777
288,[햄지]Hamzy,UCPKNKldggioffXPkSmjs5lQ,rna-BYoZ-V4,"리얼먹방:) 너무 맛있는 엄마표 양념게장★ft.갓김치,계란후라이ㅣYangnyeom-gejangㅣMUKBANGㅣ",2134684,36075,709
289,[햄지]Hamzy,UCPKNKldggioffXPkSmjs5lQ,ALXQDajXfiQ,"리얼먹방▶된장밥을 먹기 위해  투뿔2+ 꽃등심을 구웠습니다...☆ft.파김치,소주ㅣBest Grade Grilled Hanwoo &amp; Soybean RiceㅣMUKBANGㅣ",2664341,43823,1285
290,[햄지]Hamzy,UCPKNKldggioffXPkSmjs5lQ,jimsWQ6a_U4,리얼먹방▶전어 통으로 먹으니까 맛있네요(?) ☆ 대하구이&amp;전어회에 소주한잔ㅣ Raw Gizzard Shad Fish &amp; Grilled King PrawnㅣMUKBANGㅣ,4613806,60019,1557
291,[햄지]Hamzy,UCPKNKldggioffXPkSmjs5lQ,Y7QOcW9HQuE,리얼먹방▶불닭볶음면 &amp; 우삼겹구이☆디저트는 아이스크림ㅣBuldak Spicy Noodles &amp; Grilled Beef LoinㅣMUKBANGㅣ,3052273,55952,1156
292,[햄지]Hamzy,UCPKNKldggioffXPkSmjs5lQ,mDyo3H5iUCk,"리얼먹방▶이거(?) 하나 추가하면 아주 특별한 수육 완성☆ft.항정살,막걸리사이다ㅣBossam Kimchi &amp; SuyukㅣMUKBANGㅣ",3082957,51461,1339
293,[햄지]Hamzy,UCPKNKldggioffXPkSmjs5lQ,qq5Ozqp9zdU,"리얼먹방▶매일 먹고 싶은 집밥☆돼지불고기백반,꽁치김치찌개,반찬들ㅣKorean Home MealㅣMUKBANGㅣ",4947331,66397,1258
294,[햄지]Hamzy,UCPKNKldggioffXPkSmjs5lQ,pRPwqpgZ4Dw,"리얼먹방▶쌀쌀해지면 생각나는 양곱창전골 ☆ 양대창구이,깍두기양밥,소주ㅣGopchang-jeongol &amp; SojuㅣMUKBANGㅣ",3442277,51429,911
295,[햄지]Hamzy,UCPKNKldggioffXPkSmjs5lQ,GSBAnCcQqA8,"리얼먹방▶술이 술술 &quot;송이버섯,차돌박이,관자&quot; 삼합!!ㅣSAMHAPㅣMUKBANGㅣ",2403792,40140,876
296,[햄지]Hamzy,UCPKNKldggioffXPkSmjs5lQ,E7XMQ5N6fxo,리얼먹방▶바삭 쫄깃 &quot;등심탕수육&quot; 만들기☆얼음컵 맥주🍺ㅣTangsuyuk &amp; BeerㅣMUKBANGㅣ,1963452,38841,977
297,[햄지]Hamzy,UCPKNKldggioffXPkSmjs5lQ,ZCyPYg2rzAM,"리얼먹방▶돌판에 올린 삼선짜장면☆엄마 집에서 파김치,석박지 수혈🤣ㅣJjajangmyeon &amp; KimchiㅣMUKBANGㅣ",5710952,79607,1098
298,[햄지]Hamzy,UCPKNKldggioffXPkSmjs5lQ,EMcDDADyZTA,"리얼먹방▶초간단 소고기,야채 샤브샤브☆칼국수,야채죽 먹으려고 샤브샤브 먹는사람(?)ㅣBeef Shabu ShabuㅣMUKBANGㅣ",2983570,47479,900
299,[햄지]Hamzy,UCPKNKldggioffXPkSmjs5lQ,Wi4paRbxVkQ,Do you want a bite? #shorts #BraisedOxtail,462294,15438,100
300,쏘영 Ssoyoung,UC4PpFUrfT2Pou7OwpVF0MUQ,ItdHoMViPWI,치즈 폭포 🧀 초대왕 치즈 &amp; 콘치즈 불닭볶음면 Giant Raclette Cheese &amp; Korean Fire Ramen with corn Mukbang ASMR Ssoyoung,144378,6028,239
301,쏘영 Ssoyoung,UC4PpFUrfT2Pou7OwpVF0MUQ,az_i1rFeEPM,[Mukbang Shorts] FLEX 🦞 우대갈비 랍스터 문어까지! 씨푸드보일 먹방 쇼츠 Lobster Octopus SEAFOOD BOIL ASMR Ssoyoung,27428,1622,18
302,쏘영 Ssoyoung,UC4PpFUrfT2Pou7OwpVF0MUQ,szK2jl_SkuU,오동통 통대창 🔥 짜왕 실비김치 불닭 새우 먹방 Beef Intestines Daechang Jjajang Ramen SPICY KIMCHI Mukbang ASMR Ssoyoung,589108,13185,342
303,쏘영 Ssoyoung,UC4PpFUrfT2Pou7OwpVF0MUQ,rjC-x4gjfYY,오징어 🦑 해물 알찜 가리비 불닭볶음면 먹방 &amp; 레시피 Squid Scallop Roe Seafood Boil &amp; Fire Noodles Mukbang ASMR Ssoyoung,526319,12389,347
304,쏘영 Ssoyoung,UC4PpFUrfT2Pou7OwpVF0MUQ,Hty8VZtapBQ,겉바속촉 옛날통닭 🍗 직접 만든 오징어 비빔국수 먹방 레시피 Fried Chicken &amp; Seafood Squid Noodles Recipe Mukbang ASMR Ssoyung,516311,12401,331
305,쏘영 Ssoyoung,UC4PpFUrfT2Pou7OwpVF0MUQ,988nAtT2X8c,[Mukbang Shorts] 심야에 배고파서 편의점 먹방 쇼츠 😍 Korean Convenience Store Food ASMR Ssoyoung,36526,2145,18
306,쏘영 Ssoyoung,UC4PpFUrfT2Pou7OwpVF0MUQ,8WaoYvS_HrY,랍스터 &amp; 문어 🦞 우대갈비 미국식 해물찜 씨푸드 보일 먹방 레시피 Lobster &amp; Octopus Seafood Boil Recipe Mukbang ASMR Ssoyoung,763233,14998,386
307,쏘영 Ssoyoung,UC4PpFUrfT2Pou7OwpVF0MUQ,YypTVADT0JM,해물 닭다리 볶음탕 🔥 직접 만든 스팸 &amp; 파김치 먹방  Braised Seafood Spicy Chicken Stew with Spam Mukbang ASMR Ssoyoung,633336,13788,465
308,쏘영 Ssoyoung,UC4PpFUrfT2Pou7OwpVF0MUQ,Xp0SN8NSdOc,편의점 🧡 직접 만든 치즈피자 치즈불닭 짜파구리 디저트 먹방 Korean convenience Store Food Ramyun Dessert Mukbang ASMR Ssoyoung,799771,19851,442
309,쏘영 Ssoyoung,UC4PpFUrfT2Pou7OwpVF0MUQ,xuxwmVN743Y,[Mukbang Shorts] 대왕 문어다리 🐙 해물찜 먹방 쇼츠 Spicy Giant Octopus Seafood Boil ASMR Ssoyoung,61033,3459,32
310,쏘영 Ssoyoung,UC4PpFUrfT2Pou7OwpVF0MUQ,1SvJsOUBdAw,핵맵 🔥 마라 새우 &amp; 불닭 팽이버섯 먹방 Mala Shrimp Korean Fire Buldak Enoki Mushrooms Seafood Mukbang ASMR Ssoyoung,637835,13688,399
