comment_id,comment,video_id
UgygQ9MdtBJFKON1nY94AaABAg,"when bread unnie said oikawa should be playing overseas i screamed that's why oikawa is leading a team in argentina. furudate sensei should have given him justice, like his character is the ""GRAND KING"", he should be given another spotlight 🥺",nUhkJdcb_6I
UgyZDvFqcJwzliQGv5R4AaABAg,누가 예수가 성경책 리뷰하는 느낌이래 ㅋㅋㅋㅋㅋ,nUhkJdcb_6I
UgyUxF7wsGfFHEjG5jt4AaABAg,"Every Haikyuu!-fan at that part stopped breathing for 15 seconds, and then cried. Bread Unnie just like ""Is it over? IS IT FINALLY OVER. YES!?"". I laughed more than I should at that part. I guess it`s easier to get into it if you actually watch the anime, and not just clips from it. Gotta love it.",nUhkJdcb_6I
UgyRDkh2rz0HJcZ4FIF4AaABAg,언니들 4강 진출 축하드려요!!!!!!!!!!!!보는 내내 심장 터질거같았어요ㅜㅜㅜ 진심으로 축하드려요👏🏻👏🏻,nUhkJdcb_6I
Ugzm7EEw9C9FANxnQaN4AaABAg,알리 제발 주기적으로 출연해줘요ㅋㅋㅋㅋㅋㅋㅋㅋㅋㅋㅋ별거 아닌듯이 말하는데 겁나웃겨 어떻게 안 웃짘ㅋㅋㅋㅋㅋㅋ,Dq5elHFbq9Q
Ugyg3OI-GWAOHH3CTcF4AaABAg,"저... 터키에서 한국으로 가는 비행기안에서 유모차 내려주셔서 감사합니다.
제 배우자가 비행기 짐칸안에 있는 유모차를 못내리고 힘들어할때, 왠 키 큰 분이 도와줬는데 알고보니 김연경 선수였다고 합니다.
비행기 안에서는 못 알아보고 그냥 여행다니는 여학생인줄 알았대요.
무척 놀랐고 또 감사했습니다. 
아기와 화상통화할때 세계 최고의 배구 선수가 유모차 내려줬다고 말해줬어요. ^^
그리고 구독도 했습니다!

얘기를 어떻게 마무리할지...
음... 항상 응원하겠습니다~~!!! 화이팅입니다~~~~!!!!! ^^",Dq5elHFbq9Q
UgzGLSGTQ2S58pVwhBN4AaABAg,"ㅋㅋㅋㅋㅋㅋㅋㅋㅋㅋㅋ “너 더러워?” 하는 알리님의 말에 지난 날의 수난을 갚겠다는 의지가 보여욬ㅋㅋㅋㅋㅋㅋㅋㅋ 언니가 만드신 호떡이 알리님 얼굴 만해서 빵 터졌어요 ㅋㅋㅋㅋ 알리님 코어 힘이 대단하시군요! 호떡 위에 바닐라 아이스크림 얹어 먹으면 더 맛있어요!! 그나저나 편집팀 ㅋㅋㅋ 오른쪽에 깨알 팝콘과 중간에 손씻기 광고, 알리님이 언제 처음 호떡 먹었는지 물어볼 때 어떻게든 넣어보려 했던 감동코드 BGM  때문에 더더 재밌었어요 ㅋㅋㅋㅋㅋ",Dq5elHFbq9Q
UgxBJICJxkD9rxhYXdZ4AaABAg,찍으시는 알리 아내분 안 터지시는게 너무 신기하셬ㅋㅋㅋㅋㅋㅋ나도 이렇게 웃긴뎈ㅋㅋㅋ,Dq5elHFbq9Q
UgwEhL0jpMODu9IY5FR4AaABAg,두 분 티키타카 너무 재밌고 웃긴데 ㅋㅋㅋ 한편으로는 연경선수가 타지에서 많이 믿고 편하게 지낼 수 있는 사람이 있어서 안심이 되고 감사하네요,Dq5elHFbq9Q
UgxNUSq-phtwqNQLptF4AaABAg,"김연경,, 아마 여고 앞에서 호떡장사를 했어도 월매출 3억은 찍었을 매력",Dq5elHFbq9Q
UgysTNw8eegcQhSxNjl4AaABAg,아니무슨ㅋㅋㅋㅋㅋ터키에서 한국말하는 터키사람이랑 호떡을 만들고 터키사람은 호떡만들다 잠깐 깐풍기를 먹고와옄ㅋㅋㅋㅋㅋㅋ진짜 위아더 월드닼ㅋㅋㅋ,Dq5elHFbq9Q
UgwEULJ9ZRoBrtoif8p4AaABAg,6:58 진짜 알리 너무 귀여움....평가받기 기다리는 저 표정 순수해..,Dq5elHFbq9Q
UgwSo2em33vFsomj5yV4AaABAg,"I love how she don’t make people feel awkward with her😍😍 even when you watch other variety show that she goes, she really make people easy to feel comfortable with her 😍😍😍😍",Dq5elHFbq9Q
UgxhvBRI5Ts2a8_tBdt4AaABAg,평소 습관대로 여보 이거 내꺼야 했다가 민망해 하는거 왤케 귀엽냐 ㅋㅋㅋㅋ 그걸 또 받아주는 김연경 ㅋㅋㅋㅋㅋ,Dq5elHFbq9Q
Ugzct6cEqYtgVW_3_Q54AaABAg,이상하게 항상 조금씩 망하는게 너무 웃김ㅋㅋㅋㅋㅋㅋㅋㅋㅋㅋㅋㅋㅋㅋㅋㅋㅋㅋㅋㅋㅋㅋㅋㅋㅋㅋ,MUzRNkZp4Jw
Ugz5rzj5Mm2vXNZ248l4AaABAg,"알리님 완전 한국인 아니냐며ㅋㅋㅋㅋㅋㅋㅋㅋㅋㅋㅋㅋ
수플레 뒤집을 때 전 뒤집는 한국인 같았어요ㅋㅋㅋㅋㅋㅋㅋㅋㅋㅋㅋ",MUzRNkZp4Jw
UgxQNjV2Hx7__-ZuFwV4AaABAg,둘이 티키타카 개웃기네ㅋㅋㅋㅋㅋㅋㅋㅋㅋㅋㅋㅋㅋㅋㅋㅋㅋㅋㅋㅋㅋㅋㅋㅋㅋㅋㅋㅋㅋㅋㅋㅋㅋ 진짜 내내 싸워 아주 ㅋㅋㅋㅋㅋㅋㅋ,MUzRNkZp4Jw
UgzKjW1VsglQJxhNuwt4AaABAg,10:21 아 진짜 알리반응 너무 웃곀ㅋㅋㅋㅋㅋㅋㅋㅋㅋㅋㅋㅋㅋㅋㅋ,MUzRNkZp4Jw
Ugw-zff-nG36fkMdmtB4AaABAg,7:06 아니 ! 어이없을때 아니부터 외치는  알리 ㄹㅇ 한국인이다 ㅋㅋㅋㅋㅋㅋㅋㅋㅋㅋㅋ,MUzRNkZp4Jw
UgwInIRGWhVI66oUjIJ4AaABAg,알리 시간 많다고 태세전환된거 너무 안쓰러운데 웃곀ㅋㅋㅋ,MUzRNkZp4Jw
UgzGGZ4maVf7vCylzOt4AaABAg,😂😂😂 These two are a good combo 🤣 aaah~ thanks for the laughs. I hope Ali and his wife are doing fine in Turkey 😊🍞✌🏼,MUzRNkZp4Jw
UgzzGTnltII3To2sIet4AaABAg,"아닠ㅋㅋㅋㅋ 이쯤이면 달고나 때 부터 알리님 몰래 카메라 아니에요?? ㅋㅋㅋㅋㅋㅋㅋㅋㅋㅋㅋㅋ 언니랑 알리 님 두 분 다 넘 귀여워욬ㅋㅋㅋㅋㅋㅋㅋ 편집팀 깨알 자막과 중간중간 짤, 브금 등등 센스가 점점 더 bbb 크으으 bbbbb 달고나 커피도 언니 영상 보고 만들었었는데 이것도 다가오는 주말에 한번 도전해봐야겠어요! ㅋㅋㅋ",MUzRNkZp4Jw
Ugx_LC_pLiLPPEXzWxl4AaABAg,오랜만에 이영상 또 보는데 어떻게 5번을 돌려봐도 재밌냐구요ㅠㅠㅜ알리연경언니 케미 너무 좋아ㅠㅠ💕 중간중간 너무 웃겨서 포도 먹으면서 보다가 포도즙이 코로 들어갔네요,MUzRNkZp4Jw
UgyL-X3UI9Uyqj6Znz14AaABAg,"우리언니 안그래도 팔근육 예술인데 이 시국에 더 단련이라니💪ㅋㅋㅋ 가만히 못있는 인싸요정 🧚🏻‍♀️ 오늘 근접샷 왜케 이쁘고 멋있나요? ㅠㅠㅠㅠ
노랗고 동그란 물체는 뭐든지 잘 다루는(?) 식빵언니 
코로나 조심 두번 조심하시구, 한국 언능와요...🙏🏻",MUzRNkZp4Jw
Ugw6TQFLPLyAK6555Yx4AaABAg,언니도 타투할때 엄마한테 등짝 맞으시나요ㅋㅋㅋㅋ 역시.. 세계탑도 피할 수 없는 엄마의 손길...,B5KnCzjrFDs
Ugw4clCdusmHTtdxopt4AaABAg,언니 한주에 약 400만명 본다니까 안물 안궁 하는거 너무 커엽고 머싯따ㅠㅠㅠ,B5KnCzjrFDs
Ugwv6mweX_lPf2k5keF4AaABAg,언니 영어자아랑 한국어자아랑 동기화돼서 웃갸욬ㅋㅋㅋㅋㅋㅋㅋㅋㅋㅋㅋㅋㅋㅋㅋ we dont want to know 안물안궁 ㅋㅋㅋㅋㅋㅋㅋㅋㅋㅋㅋㅋㅋㅋㅋㅋ,B5KnCzjrFDs
UgyuBSL0k0K8MZDimal4AaABAg,"Vim aqui depois das olimpíadas, a amizade delas é mt legal, estou vendo todos os vídeos que tem a natalia",B5KnCzjrFDs
Ugxlaw6JgdI4vImBj3N4AaABAg,앜ㅋㅋㅋㅋㅋㅋㅋ 인스타 어쩌구 먹금하는거 ㄱㅇㄱㅋㅋㅋㅋㅋㅋㅋ 그리고 도안 미리 찍어낼때 계속 직선이라고 우기는 것도 단호하게 아니라고 하시는것도 너무 멋지네요ㅎㅎㅋㅋㅋㅋ,B5KnCzjrFDs
Ugzg28goa2hEO9m5lxl4AaABAg,오늘 브라질경기에 이 분이 있었구나 새삼 월클인거 다시 느낀다 갓연경,B5KnCzjrFDs
Ugwl7fh00RvZIBVm5k94AaABAg,que amizade bonita 🥺,B5KnCzjrFDs
UgxO_4ASFK5GKAWdiA94AaABAg,역시 타투는 선타투 후뚜맞,B5KnCzjrFDs
UgzkGrDhg3IrifB0t114AaABAg,안산시 항상 가만있는데 홍보되는거 왤케 운좋음ㅋㅋㅋㅋㅋㅋ,B5KnCzjrFDs
UgwgQj3KmC2ZVPVFf3N4AaABAg,Love their friendship 💫,B5KnCzjrFDs
UgyZt1_9JvNl7LOnmFB4AaABAg,누가봐도 알리 연경언니한테 한국어 배웠음.. 인중때려버린다라니... ㅠㅠㅋㅋㅋㅋㅋㅋ,lVkt85kUYYw
UgzAW5kKzbk4TjjKjzp4AaABAg,알리씨 귀여워서 주기적으로 보러옴 ㅋㅋㅋㅋㅋㅋ,lVkt85kUYYw
Ugw6UYWwNWBmNw3zMJJ4AaABAg,"12:36
마지막에 알리의 ""사람들아,화이팅!"" 
귀여워ㅋㅋㅋㅋㅋㅋㅋㅋㅋㅋ",lVkt85kUYYw
UgxSbPilrQQr0DQUB-R4AaABAg,"언니가 영상 한번만 보지말고 몇번 보라는게 말이안돼..
넘 재밌어서 주기적으로 보러 오게 됨 ㅠㅠ 
언니랑 알리한테 인중 맞아도 좋을듯.. ❤️",lVkt85kUYYw
UgwGjJlTfPFqGTjr_9p4AaABAg,ㅋㅋㅋㅋㅋㅋㅋㅋㅋㅋ 한 시간 넘게 저었는데도 안된거면 솔직히 뭐가 잘못된 건지 원인 파악 할 만도 한뎈ㅋㅋㅋㅋㅋㅋ 계속 젓기 ㅋㅋㅋㅋㅋㅋㅋㅋ 약간 운동하는 사람들의 특징인 것 같음 될 때까지 노력하기 ㅋㅋㅋㅋㅋㅋㅋㅋ 알리에게 달고나에 대한 끔찍한 기억을 심어주셨네요 ㅋㅋㅋㅋㅋ,lVkt85kUYYw
Ugw_PirOYFu-hWkl4N94AaABAg,"알리가 인중 때린다는데 왜이렇게
흐뭇하게 보세요 연경언닠ㅋㅋㅋㅋㅋㅋㅋㅋㅋ",lVkt85kUYYw
UgxFB0ZV0JnANndMNGV4AaABAg,인중을 때려버린댘ㅋㅋㅋㅋㅋㅋㅋㅋㅋㅋㅋㅋㅋㅋㅋㅋㅋㅋㅋㅋㅋㅋㅋㅋㅋㅋㅋㅋㅋㅋㅋㅋ요즘 웃을 일이 별로 없었는데 간만에 웃었네요ㅋㅋㅋㅋ 연경님 건강조심하시길🙏🏻,lVkt85kUYYw
UgxilJjXrA-2hmbKIz14AaABAg,진짜 한 오백번은 본 거 같은데 왜 볼 때마다 새롭지?? 역시 우리언니는 질릴수가 없나봐❤️👑,lVkt85kUYYw
Ugwyvc0uslc956cRwfl4AaABAg,11:19 쯤부터 알리님 대답하는데 “만들어!” “응!” 이거 왜이렇게 귀여운거에여ㅠㅠㅠㅠㅠㅠㅠ,lVkt85kUYYw
UgzW-XK4Lf4aPZZnRtx4AaABAg,"4:32 좀 빨리 준비해주시겠습니까?
넌 집에 가위없어? ㅋㅋㅋㅋㅋㅋㅋ 바로 받아치는 ㅋㅋㅋㅋㅋㅋㅋ 알리 지지않아 ㅋㅋㅋㅋㅋㅋㅋㅋㅋㅋㅋㅋㅋㅋ",lVkt85kUYYw
UgxL8MEtcEh_-z0ht0R4AaABAg,혼자일 때도 괜찮은 사람 책읽는거 보면서 여러감정이 교차하네요 배구선수로 세계최고선수라 인정받는 연경씨도 수년간 해외생활이 힘들고 외로웠을 것 같아요 팬으로써 마음이 좋지않네요 항상 최고라는것을 증명해야하는 자리를 10년 넘는 시간동안 지키고 있는 당신이 자랑스럽습니다 우리나라 구기종목 역사상 최고의 보물 김연경 선수 항상 응원합니다,I2eoS9Mui5g
UgwJRDdbpzNb5axYCrl4AaABAg,진짜 내가 제일 좋아하는 힐링 가득한 영상 아니 이젠 그냥 언니 옆자리에서 타고 가는 승객이 되고싶을 지경이야.. 은근슬쩍 카메라 의식하는것도 너무 기엽고...배고프다고 라면 시켜 먹는 것도 귀엽고...페퍼민트 없다고 속상해하는 것도 귀엽고..조커 본다고 표정 막 쓰는 것도 귀엽고..다리 접어서 책 보는 건 멋있고...아니 그냥 거대한 흰담비 같아ㅠㅠ 진짜 그냥 냅다 껴안고 잡혀가고싶다,I2eoS9Mui5g
UgwaIepUgU2vGQq8AdV4AaABAg,"5:49 조커 영화 봐서 신난 연경언니 귀요미 모먼트❤️ 돌려봐야지
6:02 보고싶은 영화 보게되어서 너무 좋아하는 연경언니
6:14 안경쓴 연경언니
6:36 연경언니의 들숨날숨
6:42 연경언니의 인자한 미소 심쿵 ㅠㅠㅠ",I2eoS9Mui5g
Ugzr8ZuqzBOaltqJZ2x4AaABAg,6:44 I CRIED LAUGHING SO HARD. YEON KOUNG'S EDITOR IS SO GOOD AND FUNNY. <3,I2eoS9Mui5g
UgzaooCD6xVK9BQBfqt4AaABAg,"한일전 진짜 명승부
감사했습니다 
고생하셨습니다 
배구 국가대표 화이팅!
힘내세요!
연경씨 홧팅!",I2eoS9Mui5g
UgwBIM5ZqG8Db-kt6hx4AaABAg,"연경선수의 인성이 돋보이는 일화 (긴글 주의)


예전에 김연경 선수와 같은 비행기를 탔던 적이 있음 
이륙 전 심심풀이로 실시간 기사 검색하던 중 연경 선수가 지금 터키로 출국한다는 기사를 보고 설마 같은 비행기??? 라고 생각하며 근처 자리를 보니 누가 봐도 너무 긴 다리가 덜렁 뻗어 있어서 연경선수임을 직감함
그 칸에 승객이 연경선수, 저 포함해서 3~4명정도뿐이라 살짝 아는척 하고 싶었지만 연경선수가 방금까지 기자들한테 사진까지 찍히고 온 상태고 자정 출국 비행기라 너무 피곤해할 것 같아서 아는척은 못하고 나혼자 좋아서 콩닥콩닥 대고 난리남.
 “연경 선수 덕분에 너무 행복했었다”다는 그 말 한마디를 꼭 전해주고 싶어서 다음날 아침 이스탄불 공항에 내리기만 기대하고 있었음
이스탄불 공항에 착륙후 부푼꿈을 안고 연경선수 근처로 계속 이동했지만 연경선수는 양손에 봉다리와 짐으 한가득 든채로 아주머니와 계속 담소중이라 좀처럼 대화할 기회가 나지 않았음,
아주머니 키에 맞춰 연경선수가 거의 폴더로 허리를 숙인채 들어주고 대답하고, 하하호호 아주 친밀한 분위기라 단란한 친척 사이를 방해하면 안될 것 같아 그냥 소심하게 지켜봄
나는 이스탄불이 경유지였기 때문에 연경선수랑 방향이 달라서 점점 애타하면서 보고있는데 연경선수랑 가는 방향이 계속 같은거임.. 뭐지??? 라는 생각이 들때쯤
경유게이트에 도착했는데 갑자기 연경 선수가 양손에 들었던 많은 짐을 그 옆에 계신 아주머니한테 드리더니..잘 가시라고 빠이빠이, 조심히 가세용~ 하는고임!!
알고 봤더니 그 아주머니는 연경선수 친적이 아니고 그냥 일반 승객이었음
게다가 다른 국가가 목적지였던 아주머니는 직항이 아닌 경유가 처음이라 길을 몰라 연경선수가 직접 데려다 주고 아주머니의 양속가득 짐도 대신 다 들어줬던 것! 
혼자 감동하고 난리난 상황에 연경 선수는 백팩 하나만 메고 가벼운 발걸음으로 성큼성큼 멀어져 감…

인사도 못하고 응원의 말도 전달 못했지만 몇 년이 지난 지금도 그 광경은 잊을 수가 없음 
그렇게 나에게 연경선수는 진짜 멋있는 사람으로 기억되어 왔고 (그 아주머니도 행복한 기억으로 남아 있지 않을까?), 최근에 이상한 사건에 “절대 그럴일 없는 사람임!!!” 이라고 주위에도 말하고 다님

작금의 사태에 혼자 열받아 연경선수 관련 영상 찾아보던 중 그날의 기억이 떠올라 끄적끄적..",I2eoS9Mui5g
UgxJxhlyayDLEPT3D354AaABAg,썸네일이 너무나도 잘생겨서 들어오지 않을 수 없었다,I2eoS9Mui5g
Ugy_hWeQokyOYu7d9_14AaABAg,"오늘 배구 8강 진출로 국뽕 제대로 맞고 오랜만에 와서 다시 봅니다…진짜 연경선수 잘생쁨도 세계클라스 왤케 잘생긴겨 
피지컬도 되겠다 모델 활동도 꼭 해주면 좋겠다는 생각도 해봅니다",I2eoS9Mui5g
UgxO0-sKZByKxw6v10B4AaABAg,우리나라에서는 친숙해서 그런가 되게 재밌는데 외국 사람들은 약간 축구로 치면 메시가 브이로그 찍는 느낌일까,I2eoS9Mui5g
UgxmNyWBcnH5xZ1zc754AaABAg,이 영상 넘 조와요.. 차분한 분위기.. 언니와 마주 앉은 것 가튼 구도.. 7분 내내 뽀시락뽀시락 움직이고 말하는 언니 구경..🧡 하 언니 너무 좋아 사랑해 ( ᵕ̩̩ ᯅ ᵕ̩̩ ),I2eoS9Mui5g
Ugy9q-I8d_CK0e0Gz8R4AaABAg,위로금받았다고 욕하는사람들 참 할말없네 항상 응원합니다,kVhS8w7A-xc
UgwocaQXfZJT8HkzQqp4AaABAg,이거 저장해두었다가 힘들 때마다 찾아볼게요 고마워요 언니ㅠㅠ 항상 멋있는 모습 뒤에서 긴 밤에 지쳐 고민하는 언니 또한 응원하고 있을게요! 여왕님 오늘 라이브도 수고 많으셨습니다(할 일이 늦게 끝나 다는 못 봤지만 ㅠㅠ) 사랑해요 워 아이니 아이시테루 이히 리베디히 세니 세비요름 푹 주무셔요 ^♡^~,kVhS8w7A-xc
UgzGED3AaROoFxGfZgd4AaABAg,"우리 언니 욕하는 사람 있나? 
탕

더 있나?",kVhS8w7A-xc
UgypsRw8jbZDZVL9a2B4AaABAg,언니는 뭐 컨텐츠 개발할 필요도 없어요 그냥…그냥 일상 모습 무편집으로 올려도 너무나 감사…영광..:,kVhS8w7A-xc
UgwRY2SYEAH3YVevaqF4AaABAg,프로 선수가 연봉으로 말하는건데... 개인적인 희생이 참 컸네요ㅠㅠㅠ 건강하게 회복해서 코트에서 다시 만났으면 좋겠어요~ 항상 응원하고 사랑합니다~❤️❤️❤️❤️❤️❤️❤️,kVhS8w7A-xc
UgxAOI1ZVM1XYakwVVZ4AaABAg,언니 너무 멋있어.. 위로금으로 받은 걸 기부할 생각부터 하구ㅠ 언니도 마음 깊어요♡ 착한 사람은 착한 사람을 알아보는 건가 봐요!! 그리고 필터 없이 말하는 언니의 매력 좋아용>< 앞으로도 힘내시구 언제나 응원해요 언니♡,kVhS8w7A-xc
Ugzbr2BmfGUxB-5wj7J4AaABAg,"김연경 선수님은..깜짝 놀라면 뭐라고 하실까...
Oh.. my... me..?


사랑합니다 .. 평생...",kVhS8w7A-xc
UgzRJTpw31HFzZB_F1t4AaABAg,"유툽, 경기 볼때마다 치이는데 오늘은 레알로다가 차에 거하게 치였다....제일 멋짐ㅠㅠ 위로금 받았다고 욕한 사람들은 원래 뭘해도 트집잡아 불평불만 열폭하는 사람들이니 응원하는 사람들의 목소리만 들어요!!!",kVhS8w7A-xc
Ugz9iFZqiposJcEXsed4AaABAg,"""True happiness comes from small things"" ❤",kVhS8w7A-xc
UgwqfnlahosqRh7SUxx4AaABAg,"아시아 예선 내내 카메라를 들고 다니면서 정작 자신은 나오지 못하는 수지킴 선수가 이 영상의 일등공신이네요.
김수지 선수 고마워요!",9E6SJYgbsYE
UgxNbk9gUnlPIbZ2PfB4AaABAg,희진언니 엄청 울었는ㄴ데 계속 안 울었다고 어필햌ㅋㅋㅋㅋㅋㅋㅋㅋㅋ 너무 귀여워ㅠㅠㅠㅠㅠㅠㅠ당신들 정말 최고야,9E6SJYgbsYE
Ugzh5r_kgFKHA3p-ovV4AaABAg,"말이 쉽지, 국가대표라고 자신의 몸을 희생해서 국가를 위해 뛴다는게 정말 어려운 일이잖아요.
일반인들은 복근이 찢어지는 부상을 당하면 뛰기는 커녕 걷는것도 아프다고 하는데
그런 부상을 당하고도 오직 한 경기 올림픽 진출을 위해서 진통제를 먹고 복부를 몇겹씩 테이핑하고 뛰는 모습을 보고
정말 멋있고 대단하다고 생각합니다. 대표팀을 도쿄로 이끌어주셔서 팬으로서 감사합니다.


선수들의 희생으로 일구어낸 올림픽 티켓, 어쩌면 김연경 선수의 마지막 올림픽이 될수도 있는 도쿄올림픽...
저는 좋은 예감이 듭니다. 선수들의 희생이 올림픽 본무대에서 갚진 결과로 돌아와서
환하게 웃는, 기쁨의 눈물을 흘리는 모습을 봤으면 좋겠습니다~ 여자배구 대표팀 화이팅!!",9E6SJYgbsYE
UgxQ0wAebbb18o7gjut4AaABAg,자기 복근 찢어지는 소리 들으면서도 끝까지 올림픽을 위해 포기하지 않고 뛰는 언니 존경해요🙏👍 목표향해 다들 힘들텐데도 최선 다한 우리 여자배구대표팀 모두 최고에요!! 경기 이후 부상소식 많았던 선수들 다들 재활 끝내고 건강하게 돌아와줘서 얼마나 다행인지 몰라요 이놈의 코로나때문에 개최가 분명하지 않게된 올림픽이 어쩔수없다는걸 알면서도 야속하네요😭,9E6SJYgbsYE
UgzRN5b-s9_IaNnuR5Z4AaABAg,"우리대표팀 이렇게해서 올림픽갔는데 세계랭킹 한자리수 강팀들이겨서 4강까지, 최종 4위까지 했다는게 너무 멋있고 대단하다ㅠㅠ 부상에도  이기겠다는 마음으로 열일한 연경언니 덕분이기도..! 역시 최고bb",9E6SJYgbsYE
UgzKPY5LYXkDJzjPW2t4AaABAg,"12팀만 가는 올림픽 본선가기고 쉬운일이 아니라는거.. 랭킹 1위가 금메달따고 랭킹 2위가 은메달을 땄지만, 랭킹 13위인 우리나라가 3/4위전까지 진출했다는건 엄청난 것이란걸 잊지말아야",9E6SJYgbsYE
UgxnbOfdTFX45-Dsz694AaABAg,경기 끝나고 선수들 우는거 보고 같이 펑펑 울었었는데 그때의 상황을 얘기해주니까 언니가 얼마나 아팠을지 또 눈물 나요ㅠㅠㅠ지금은 다행히 회복 잘 하고 있지만 이젠 정말 다치지마요 언니ㅠㅠㅠㅠㅠ다른 선수들도 진짜진짜 너무 고생하셨어요❤ 여배 국대 메달 따자!!🥇🥈🥉,9E6SJYgbsYE
Ugx2Y5426wldNAw92vx4AaABAg,이랬던 팀이... 이제 4강에 올라왔다니... 가슴이 웅장해진다...🥲,9E6SJYgbsYE
Ugysz2OPKiV5qrRvH4R4AaABAg,"경기 못 보러 간건 너무 아쉽지만 그래도 정말 너무 잘해줬어요 우리 언니들 ㅠㅠㅠㅠ보면서 같이 펑펑 울었는데 부상 당했음에도 굴하지 않고 모든걸 보여줬던 우리 식빵언니 , 영원한 제 롤모델 쳐1 우리 희진씨 ㅠㅠㅠㅠ 선수분들 모두 너무 고생하셨어요 늘 열심히 해줘서 고마워요 ❤",9E6SJYgbsYE
UgxFSGjHvM-K4BYXCAR4AaABAg,"U really set the bar too high for a CAPTAIN! Kim Yeon Koung! I'm really in tears watching this T_T... U give an example on how to become the best leader and player for young generation! 
. 
Women korean volleyball inspirational story to reach tokyo olympic will always be remembered as one of the best history for korean people. And how u endured all the pain and keep doing ur best till the end for ur team and country will always be inspirational for many people outthere  :) 
. 
Ps : Kim Suji is really the best friend u need in ur life (i want to have kim suji too :') ) she did all the record to show people how the process to achieve one of ur dream, i could feel her sincerity and warmness through the screen! 
. 
All the best for bettter future girls!",9E6SJYgbsYE
UgztR__eliNErKRbPbd4AaABAg,대본 못외우고 흘끔흘끔 하는 거 진짜 너무 귀엽다.. 언니 최고....,SZ1a0i0UopE
UgyRjrhyIzazU7k0sS54AaABAg,복근 찢어지는게 칼에 찔리는 고통이랑 같다던데 진짜 진통제까지 맞아가며 경기뛰는 언니보면서 멋지다고 생각하는 한편 얼마나 아플까 생각하니 마음이 너무 아팠습니다..언니 항상 덜 다치고 건강하길 바라겠습니다 김연경선수최고! 그리고 심각한 내용 넘나 재밌게 찍어주셔서 웃으면서 봤네요ㅋㅋㅋㅋ실력도 최고 재치도 최고~!,SZ1a0i0UopE
UgwOiD8E_AlmQ373hjx4AaABAg,힘든것도 웃으면서 잘도하네요 꼭 저녁마다봅니다,SZ1a0i0UopE
UgyeCkI-lN4IgJeCXgx4AaABAg,"저게 어떻게 재활운동이야.....
존나 힘들어보이는뎈ㅋㅋㅋㅋㅋㅋㅋㅋㅋㅋㅋㅋㅋㅋㅋㅋㅋㅋㅋ
나한텐 재활운동이 아니라 극기훈련이다",SZ1a0i0UopE
UgyDURdeSXVFA9eOeD14AaABAg,진짜 천재는 타고난것도 타고난건데 스스로 노력하는게 어마어마하단 걸 언니 보고 느껴요... 힐끔거리는것마저 귀여우면 어쩌라는건진 모르겠지만...,SZ1a0i0UopE
UgxNXl7MIGKkwQsvSA94AaABAg,"ㅠㅠㅠㅠㅠ 언니 요즘 인스타 보면 부상 때문에 코트 못 뛰어서 넘 우울해보였고, 부상은 다 회복하고 터키 가시는건가 싶어서 걱정 많이 했는데 이렇게 소식 알려주셔서 감사해요!! 출근 준비고 뭐고 식빵언니부터 봤어요 ㅠㅠ 엉엉 ㅠㅠㅠㅠㅠㅠㅠ 그나저나 김연남 기자 완전 제 스타일이에요!!!! 한번 만나보고 싶어요!! ㅋㅋㅋㅋㅋㅋㅋㅋㅋㅋㅋㅋㅋㅋㅋㅋㅋㅋ",SZ1a0i0UopE
UgzpQkuTNzaUFmbXSYV4AaABAg,참이런선수 없습니다..실력이 좋다고 해도 국가를위해 뛴다고 하지만 애국심도 개인적으로 차이가 있는지라.. 억단위돈도 포기하고올림픽하나만위해 바라보는 김연경선수.. 올림픽에서 결과좋던 안좋던간에 박수쳐주고 응원하겠습니다..,SZ1a0i0UopE
Ugy3W2FYwKoSN_VN-TZ4AaABAg,취재에 힘써주신 김연남기자님 감사합니다🙌 덕분에 우리 언니 재활소식도 좀 더 자세히 알게되서 너무 좋네요👍 부상인걸 알면서도 국대로서 대회에서 그렇게 최선을 다해 경기 해줘서 정말 고맙고 또 고마워요😢 코로나바이러스 조심하구 언니 건강해야해요🙏❤️💜,SZ1a0i0UopE
UgwEY2Y0ZZmrzTZApqN4AaABAg,공놀이금지 개웃겨ㅋㅋㅋㅋㅋㅋㅋㅋㅋㅋㅋ 화면 천천히 들어가길래 감동샷일줄 알았는데 공놀이금지 ㅋㅋㅋㅋㅋㅋ 김연경선수 부디 다치지 말아요 우리 선수들 전부 다치지않고 좋은 경기 해내면 좋겠어요!!,SZ1a0i0UopE
Ugy7d4m1fyGZIS4aI5V4AaABAg,부상인겐 마음아픈데... 연기하는건 웃기고...,SZ1a0i0UopE
UgxyUWOZ__RLmQ6_U9J4AaABAg,언니 저번에 계양체육관에서 언니한테 진짜 반했어요 ㅠㅠ 경호원 있다고 사진 안된다고 했던 언니가 펜스를 그 긴 두다리로 넘어와 사진 찍어주고 오래 알단 친한 언니처럼 털털하고 편하게 저희를 대해줘서 진짜 평생 못 잊을 매력에 빠져버렸어요 사랑해요,tmtQzvJLscg
Ugwvh2lcpkLtlRwr-o14AaABAg,"오늘 두 분이 한 코트에서, 상대편으로 펼친 경기 너무 멋있었어요!! 여자배구 매번 감동의 연속.. 졌잘싸!!!! 연콩선수 경기운영, 리더쉽, 타국 선수들과의 관계 다 너무너무 멋져요",tmtQzvJLscg
UgzrIvWJSUIOSiX1aGB4AaABAg,nati and kim are so cute i love their friendship ❤❤❤,tmtQzvJLscg
UgxcSseQUlUCdPFG-R54AaABAg,Just keep in mind that there are a lot more people who loves and support you bread unnie than those who don't. Cheer up always unnie. I'll pray that you will get that olympic medal that you want. Sending you love from the Philippines🇵🇭,tmtQzvJLscg
UgyM_77BMYzZVEepVqh4AaABAg,"Love you both, while watching you guys playing in the same team is so comfortable, the tempo, the camaraderie, just like you two chatting there. Thank you both for the great games.#NatáliaZilioPereira #BreadUnnie",tmtQzvJLscg
UgwACcwZ_QStcBltxXx4AaABAg,Tô viciada no canal da kim omg,tmtQzvJLscg
