comment_id,comment,video_id
UgyoHj0aYJAp6hzG4SF4AaABAg,"""딸이 아직 그 개운함을 모를 수 있어""
아ㅋㅋㅋㅋㅋㅋㅋㅋㄱㄱㅋㄱㄱㅋㄲ",KF8z1QDxggw
UgzIZ5jnHerkIQPSciB4AaABAg,헤어 나올 수가 없는 영상이네요.,KF8z1QDxggw
UgyPV-i5VRbVi6NFFjJ4AaABAg,"앍ㅋㅋㅋㅋㅋㅋㅋㅋ 아....
언니 아빠랑 오빠 표정 개웃겨요
의문에 1패ㅋㅋㅋㅋ🥺🥺⁉️",KF8z1QDxggw
Ugzy4qqo9Jp7PItmGu94AaABAg,가벼운 스트레칭일줄알고 다 씻고 누워서 잠들기 전에 해봤는데 등에 땀이 쫘악 나네요! 몸 다시 씻어야하게 생겼지만 엄청 시원해서 좋아요! 매일 열심히 따라해볼게요🥳,YZ_lD8bGD8U
UgyUav9H_qP4SpmNlN14AaABAg,요즘 허리가 너무 아팠는데 마침 딱맞는 영상을...! 감사합니다♡,YZ_lD8bGD8U
UgyVaWsnRMCSBEjSsEl4AaABAg,와 요즘 허리 아파서 장요근 스트레칭 뉴버전 부탁드리려고 했는데 대박이에요ㅜㅜ♥,YZ_lD8bGD8U
UgwsGbPuEUE9WsrvZvV4AaABAg,장요근 스트레칭과 강화 운동에 정말 적합한 영상입니다! 도움 받고 있어요. 감사합니다!,YZ_lD8bGD8U
Ugxr917zeDLk-xY50Zh4AaABAg,요즘 헬스장에 다니면서 스피닝이나 레그프레스를 하고 나면 항상 허리부터 골반아래까지 뻐근했는데 이 영상이 너무 도움이 될 것 같아요 감사해요😭😭,YZ_lD8bGD8U
UgwioAX819wHRt5-lOB4AaABAg,"장요근 쉬울줄 알았는데…엄청
힘드네요.. 그래도 하고 나니
개운하니 저녁도 잘 잘듯합니다.
매번 설명을 차근차근해주시니
지루할틈도 없이 금방 운동이
끝나네요.ㅎㅎ감사합니다.
편안한 밤돼세요🙏🌱🥰😍😘",YZ_lD8bGD8U
UgxHrVcK1KKbsgFUxfR4AaABAg,10년정도 요통때문에 힘들었는데 저번편하고 번갈아가면서 하는데 허리통증이 절반이상 줄었습니다. 생활의 질이 상승했어요.. 너무 감사합니다.!!~😄,YZ_lD8bGD8U
UgzLLKjnHNhuZ0xyCBh4AaABAg,와.. 진짜 더워요 마치 근력운동한 것처럼..!! 따라하고 나니까 개운한 느낌 너무 좋아요 👍,YZ_lD8bGD8U
UgxBid2jQEQ4zu2W3jd4AaABAg,딱 필요한걸 해주시네욤! 매번 감사합니다👍👍👍👍👍👍👍👍👍,YZ_lD8bGD8U
UgyPmJF-LPFmY56-7B94AaABAg,우리가족 철만들지말고 내말좀듣자~,en1Wl5HLOTY
UgzV-D5oDfG4vqKnmZd4AaABAg,3대 오백을 쳐도 모든 종목의 우월한 엄마를 이길 순 없었다,en1Wl5HLOTY
Ugy1EZMWh0YDwyn7uGN4AaABAg,"너무 재밌게 촬영 했어요~~
우리 으뜸이 최고!!  고마웡~~",en1Wl5HLOTY
UgzNhBZXCuFo3YbWZv14AaABAg,"엄마로 역할로 고정출연 찬성입니다!!
아빠 엄마 큰아들 둘째딸 셋째, 넷째딸까지 모두 모여 봅시다ㅋㅋ",en1Wl5HLOTY
UgxbeMSmkG6xgVTlw8t4AaABAg,2:52 어떻게든 ng를 안내려고 속으로 비명을 삼키는 모습이 진짜 웃기네ㅋㅋㅋㅋ,en1Wl5HLOTY
UgyQX7J5So9x0md4b9R4AaABAg,삼촌으로 김종국님까지 나오면 대박,en1Wl5HLOTY
UgymBNBgTLWzUHL1tc94AaABAg,등짝 스매싱 진심 찰졌다 으뜸님 표정도..ㅋㅋㅋ,en1Wl5HLOTY
Ugxi-4rhvrW6xW4xmq94AaABAg,2:52 ㅋㅋㅋㅋㅋㅋㅋㅋ으뜸님 엄총 아팠나보다 입이 천장까지 닿을듯 ㅋㅋㅋㅋ,en1Wl5HLOTY
UgzTaOXQoZv1ZKPVNdR4AaABAg,아니 솔직히 전문 연기자는 한명인데 다들 연기력 ㅋㅋㅋㅋㅋ넷이 케미 죽인다 ㅋㅋㅋㅋㅋㅋ,en1Wl5HLOTY
UgyIR8RfininUFDs2CV4AaABAg,철가루 집안 유니버스 어디까지 확장되려나ㅋㅋㅋㅋㅋㅋ확장하다가 나중에 어셈블 해서 다같이 출연해도 재밌겠다ㅋㅋㅋㅋㅋㅋ,en1Wl5HLOTY
UgyWE6ZP2CI-qBFH_Ox4AaABAg,탐폰 존나 신세계임 진짜... 생리대 쓰레기도 현타오고 새는 거 지긋지긋한 사람들 만족도 진짜 높을거임 한번만 써봐요 진ㄴ차ㅠ,j2Vf2ofAH4w
UgyErkgVymNFMv3sEPx4AaABAg,삶의 질 상승템 ㅇㅈ합니다 꼭 써보세요 저는 생리컵은 잘 안맞아서 포기했는데 이건 쉽고 재사용 안하니까 씻을 필요도 없어서 편해요.. 근데 생리중 운동은 무리하면 안됩니당ㅠ 체력적으로 후폭풍 있어요,j2Vf2ofAH4w
Ugx90Tm45FQf4y_51AF4AaABAg,여름에 특히 필수템.. 생리대는 한번 땀 차면 답이 없음,j2Vf2ofAH4w
UgxjEHwk0gQ7sfl3uzJ4AaABAg,진짜 운동할때 생리대차면 땀차고 습해서 개싫은데 탐폰쓰면 개꿀이에여,j2Vf2ofAH4w
UgzNnK-IftWV-ZEQ5iB4AaABAg,저도 생리중 템포는 필수랍니당😻,j2Vf2ofAH4w
Ugxm0zERUh2dprO491p4AaABAg,필라테스나 수영할때 템포 필수템.  특히 요즘은 레깅스입고해서리 ㅋㅋ,j2Vf2ofAH4w
UgzNIp7rVa0iDVunnGJ4AaABAg,알고리즘 왜 내 주기까지 알고 난리야;; 오늘 터진 핑계로 운동 안갓는데....,j2Vf2ofAH4w
Ugy0nnDTxJBI6-iaJ8t4AaABAg,아니 진짜 왤케 이쁘냐,j2Vf2ofAH4w
Ugww3v2GaozyZ8AJxnp4AaABAg,생리통 심한 사람은 그냥 쉬는게 맞겠죠?ㅠ 약먹고 좀 나아지면 가야하나 매번 고민...,j2Vf2ofAH4w
UgwJJ36_oMz2VDGhlTF4AaABAg,"탐폰 쓰면 생리대 특유의 땀, 습기 안 차서 좋긴한데 조금씩 새는건지 팬티에 피가 묻더라구요ㅠ 똑바로 못 넣어서 피가 새는 걸까요,,,?ㅜㅠ",j2Vf2ofAH4w
Ugx7eCvzhzMHy1TeEW54AaABAg,"I want to be strong just like you, you inspire me to workout",UeGjzxMies8
UgxgM02JeXrRTFKQJAt4AaABAg,파맆에 이렇게 진심이신 게 정말 보기 좋습니다,UeGjzxMies8
Ugwn9ioyjFT93ETjRnd4AaABAg,항상 몸 건강하시고 오늘도 본 받고 갑니다😍,UeGjzxMies8
UgxM8J8qlQRUIzbBsvd4AaABAg,역시 운동하고싶게 만드는 재주가 있으신분!!!,UeGjzxMies8
UgyNGX2TNv6ztEWHCpx4AaABAg,심으뜸의 끝은 어디…진짜멋져요… 헬스 여성 유투버 국탑…❤️,UeGjzxMies8
UgyEU8tk2vkjKVquhWR4AaABAg,파맆에 진심인것같아 너무 보기 좋습니다..,UeGjzxMies8
Ugxrbxx9wdpiKXKnXzl4AaABAg,언니 진짜 멋져요 👍,UeGjzxMies8
UgzTqGyGCFaHRsRFaG54AaABAg,잘하실거예요!근데 원래 필라테스강사라고하신것같은데 헬스도 같이하시는건지! 3대중량하신것도본것같은데 👍👍,UeGjzxMies8
UgxSSWN5Yw5AAzzCVW54AaABAg,으뜸님에게 좋은 자극을 받습니다.!,UeGjzxMies8
Ugxg0libpBEv81VibNF4AaABAg,"오늘 운동이 정말 하기 귀찮아서
이 영상 보다 얼떨결에 따라하고는
지금 몸이 만신창이 됐어요 ㅎㅎ
영하의 날씨에 땀 때박~! 
심박도 와우~!",hZytQ177pHs
Ugx1-0NEC3bFaiuNMyx4AaABAg,"스쿼트만 해도 숨차는데, Q&A까지 하시다니. 두 분 다 쩔군요^^👍👍",hZytQ177pHs
UgzW4petkTODJlNmtmZ4AaABAg,"The end was so funny and symphatic of both 😀
Das Ende des Videos war so witzig und symphatisch 😀
영상 마지막이 너무 웃기고 성격좋네요😀
Grüße aus Deutschland 👋
 독일에서 인사드립니다👋",hZytQ177pHs
UgzdvF_wCidU3I_ISrt4AaABAg,My thigh tighten up just by watching you two 🤣,hZytQ177pHs
UgzbYGgnKCoGdXE4cPd4AaABAg,"진짜가 나타났다!!!
레슬링 간판스타 남경진선수님
앞으로의 행보가 기대가 됩니다!!
자주 나와주세요!!",hZytQ177pHs
Ugw1Yd6Z5l_jnPm_1iB4AaABAg,"누워있는 내가 숨이 더 차는 인터뷰..ㅎㅎ
두분 다 넘나 매력 넘쳐요❤️",hZytQ177pHs
Ugw9YTvPDahySRPJc6V4AaABAg,400개를 정말로 하시네요!!!!! ㅎㅅㅎ 뭐랄까.. 힘들어하는 모습을 보는데 저도 모르게 웃는중 ㅋㅋㅋㅋㅋㅋㅋㅋ☺,hZytQ177pHs
UgwdumxtGCx59YAERz14AaABAg,스쿼트 100개도 하다가 지치는데 400개하면 대단하네요😱😁😄,hZytQ177pHs
Ugz2pxx7IcCC94waeM54AaABAg,두 분 조합 너무 귀엽고 즐거운 시간이었습니다😍,hZytQ177pHs
UgwiulHiYR21g_Lv4BN4AaABAg,와 이거 진짜광기다 스쿼트를 400개나 하면서 대화가 되다니 ㅁㅊ..,hZytQ177pHs
UgwT8rKxLps2TdrwxZx4AaABAg,와 진짜 우리 딸 보통아이요~~~🤙🥹,McphPDCDxE8
UgwVxZ4DfOIt-27h-BN4AaABAg,처음 파워리프팅 하시는 콘텐츠에서 정말 얼굴 밝아보이고 성과에 진심으로 뿌듯해하시는 것 같았는데 너무 멋지십니다! 건강 조심하시고 앞으로 대회 관련 소식 기대할게요,McphPDCDxE8
UgznELL8cpav4GnDfcl4AaABAg,제가 유일하게 응원하고 살앙하는 체육인 뜸대장 🤍🤍🤍 잘할 건 눈에 선하니까 걱정 안 하는데 절대절대 🚨다치지 말고🚨 잘하구 와요!!!! 파이팅 🤍🤍🤍🤍🤍🤍,McphPDCDxE8
Ugxpj897cwMG0E7AAGt4AaABAg,몸조심 하시고 노력한만큼 좋은 결과있기를 기원합니다~♡♡,McphPDCDxE8
UgxQp0519YPlgcZYupJ4AaABAg,항상 잘 보고 있는 1인입니다  으뜸씨는  무엇든지  최선을 다하시는 분이니 몸 건강하게  잘 하고 오세요  항상 응원합니다,McphPDCDxE8
UgxvCp5J8vIX1gtpjf14AaABAg,"헐 으뜸대장 멋지네요..
영상 꾸준히 잘 보고 있습니다.
다치지 마시고 몸조심 하시고 잘하고 돌아오세요!! 대장!! 화이팅 입니다!",McphPDCDxE8
UgzaocAY7YKjbQuzgb94AaABAg,다치지 마시고 꼭 준비 운동 충분히 하시고 응원 할께요~~^^,McphPDCDxE8
UgwqxHrS6UBDPqbM_KZ4AaABAg,"너무 무리하지 마시고, 조심하시고 응원하겠습니다🙏🏻",McphPDCDxE8
UgxZvPBxJt_0TxJjEK94AaABAg,운동에는 뭐든 진심인 으뜸님 넘 멋있어요 응원해요👍🏻👍🏻🙏🏻🙏🏻🔥🔥🔥,McphPDCDxE8
UgzcjxcfQgA-cgy6NqR4AaABAg,멋져용!!! 무리하지마시고 다치지마시고 응원할게용!!,McphPDCDxE8
Ugz95Qd700sgtbWjyxp4AaABAg,세명 붙었을때 스윽스윽 나가는거 되게 멋있었는데 마지막에 으뜸님 웃은거보고 빵터짐ㅋㅋㅋㅋㅋㅋㅋㅋㅋㅋㅋㅋㅋㅋㅋㅋㅋㅋㅋㅋㅋㅋ,D6FqhI8O9yY
UgyxuycfZ7IEl68_4YZ4AaABAg,"킬포인트 1. 마지막 세명일때 버티다가 마지막에 혼자 퉁겨져 날아간 으뜸님, 2. 바닥에 야무치자세로 실신한 맨 뒤 피디님 ㅋㅋㅋㅋㅋㅋㅋㅋㅋㅋㅋㅋㅋ",D6FqhI8O9yY
UgxzEubYba_N_D_J1KB4AaABAg,와 몸이 날아갈 지언정 밴드를 놓치않는 매너 멋집니다.,D6FqhI8O9yY
UgxlnkP_R1j9SVrW5-h4AaABAg,아니 막판에 털형 거의 죽이겠다고 태클 스탭으로 가시면 너무 진심이신거 아닙니까...ㅋㅋㅋㅋㅋㅋ,D6FqhI8O9yY
UgxSz8f4ZTKjjyoXIrR4AaABAg,와 그와중에 몸이 날려가더라도 고무줄을 놓지 않는 으뜸님 악력과 의지력이 눈에 띄네요,D6FqhI8O9yY
Ugwhe2TFAWNxFUQ1szd4AaABAg,피디님들 미모가 마스크를 뚫고 나오네용,D6FqhI8O9yY
UgwQAMgrpqRbEilBhaF4AaABAg,태클모습 진짜 멋있다...우와..,D6FqhI8O9yY
UgygdRhjbVpTUPBlQAB4AaABAg,너무 밝은 에너지 ㅋㅋㅋㅋ 짱,D6FqhI8O9yY
UgyP2gQkZVz1mUgsPa14AaABAg,예전에 체육관 관장님이 말씀해주신게 밖에서 절대 덤비지말라는 운동선수들이 복싱이랑 레슬러인데 그중에 레슬러랑은 절대 싸우지말라고 하던게 생각나는 영상,D6FqhI8O9yY
UgzjwqSX27Sted8mUvx4AaABAg,마지막에 날라가는거 개웃기넼ㅋㅋ,D6FqhI8O9yY
UgxOYdZEGT6BiZ70F4d4AaABAg,"[힙으뜸 제작진]

꿀잼 본편 보러가기 ▶ https://youtu.be/W0BJ7A1Evvc",UcarKaLuGGs
UgzrLjMPgtXgW6cDvT14AaABAg,여름에 더워서 제일 덜하려나 했는데 상식이 진짜 상식이었네ㅋㅋㅋㅋㅋㅋ,UcarKaLuGGs
UgyMdkzLKb362Y9zrcN4AaABAg,ㅋㅋㅋㅋ아니 양쪽이다 빡빡이에 검응슈염 흰수염이야,UcarKaLuGGs
UgwPWbNgmAjWola5U7l4AaABAg,문제 듣자마자 딱 감이 왔어요. 한국인 치킨 젤 적게 먹는 달과 답이 같음. ㅋㅋ,UcarKaLuGGs
UgwCKStLj5XpszWNdtR4AaABAg,아니 김계란 선생님ㅋㅋㅋㅋ기대니까 바로 밀쳐버리네ㅋㅋㅋㅋㅋㅋㅋㅋ,UcarKaLuGGs
Ugzvii3_QFQrgIOKI2t4AaABAg,러시아인이 보드카를 가장 적게 마시는 달 ㅋㅋ,UcarKaLuGGs
Ugy-q-gG3VDbboF3mDh4AaABAg,"세금신고관련 일 하는데, 실제로 닭집 매출이 열두달중에 2월이 제일 낮음ㅋㅋㅋㅋㅋㅋㅋㅋㅋㅋㅋㅋㅋㅋㅋㅋㅋㅋㅋㅋㅋㅋㅋㅋㅋㅋㅋㅋㅋㅋㅋㅋㅋㅋㅋㅋ",UcarKaLuGGs
UgzS5MM1Axjds6avATR4AaABAg,갱얼쥐 인형인 줄 알았어요 넘 귀여워ㅠㅠㅠㅠㅠ,UcarKaLuGGs
UgzHVy4cTuXpaVoxmVN4AaABAg,ㅋㅋㅋㅋㅋㅋㅋㅋ 왼쪽 검은수염 오른쪽 흰수염이니까 중간은 빅맘이래ㅋㅋㅋㅋㅋㅋㅋ,UcarKaLuGGs
Ugy2k99jfpUW-eXYtV54AaABAg,짱재형 개똑똑해,UcarKaLuGGs
UgzRZJcyNXOIpxnFHn94AaABAg,2차 갑시다~~ㅋㅋㅋㅋ,W0BJ7A1Evvc
UgwrUQ8_R07hU2zKp0h4AaABAg,"으뜸언니 맨날 운동하는 진지한 영상만 보다가 이렇게 술 마시면서 웃는 영상 보니깐 동네 친한 언니 같아ㅠㅠ🥹 같이 술 마셔보고 싶다,, 넘 재밌을 것 같아욬ㅋㅋㅋ",W0BJ7A1Evvc
UgyCx_Hz9BDByB8zRu54AaABAg,이 조합 너무 좋네요 ㅋㅋㅋㅋ 편안하고 재밌어요 !,W0BJ7A1Evvc
UgxaLwW0WazDRVyaGFF4AaABAg,ㅋㅋㅋㅋㅋ 진짜 너무 즐겁게 봤습니다🤣🤣,W0BJ7A1Evvc
Ugx4fh4ihwRhbeCkOF94AaABAg,착한 큰오빠 짱재 / 만만한 둘째오빠 김계란 / 귀염둥이 막내 심으뜸 삼남매 같음 ㅋㅋㅋㅋ,W0BJ7A1Evvc
UgzLer1rTh4jio-7ZF14AaABAg,이 조합은 사랑이죠 ♥ 그저 빛 너무 좋아요 !! 감사드립니다 ㅎㅎ,W0BJ7A1Evvc
UgwrBC3DGH2RjG-lJgF4AaABAg,으뜸님은 활짝 웃는 모습이 너무 예뻐요.,W0BJ7A1Evvc
UgwfAM4kx59I36Ono-N4AaABAg,3분이 친해보이고해서 너무 좋네요 다 재밌게 보는 분들인데,W0BJ7A1Evvc
UgyWD-2VVSr1KQ5i24l4AaABAg,ㅋㅋ마지막에 김계란님 폼롤러위치땜에 스스로 똥침놓는거같아요ㅋㅋㅋㅋㅋ유쾌한합방였습니다♡,W0BJ7A1Evvc
UgzbLtXUZWOTgNPNN6l4AaABAg,이렇게 가끔 술방도 좋아요😘,W0BJ7A1Evvc
UgzrpbyaLyrruNwTlLx4AaABAg,ㅋㅋㅋㅋㅋㅋㅋ 광곤데 재밌어서 끝까지 보게 됨ㅋㅋㅋㅋㅋ 멸치님 살려~~~~,jEVyN-BkRBs
UgwN4X4Pzg_GH1tOpml4AaABAg,두 분 캐미 개웃겨 ㅋㅋㅋ,jEVyN-BkRBs
UgyTE6cXHryPB4JH0WF4AaABAg,생각보다 멸치님 유연하시네요ㅋ,jEVyN-BkRBs
UgxluwsSJr9voI5UKRl4AaABAg,돼람님은 언니에게 안 밀리게 똘끼?를 발산하시고 멸치님은 그냥 질려하는 동생😂,jEVyN-BkRBs
UgyDmrgBgYAtD53szbx4AaABAg,멸치님 연기 왜케 진심 같지 ㅋㅋㅋㅋ ㅋㅋㅋ,jEVyN-BkRBs
UgwD20p8siGOk7PTNa54AaABAg,ㅋㅋㅋㅋㅋ이 시리즈가 젤재밋어요 다음편은 계란님나오실 차례인가,jEVyN-BkRBs
Ugyr-RCDqCIwNdM_dfl4AaABAg,보람님 이랑 계란님 까지 합해서 시트콤 찍어도 되겠넼ㅋㅋㅋㅋㅋ,jEVyN-BkRBs
Ugzm2aWQRurpLd_EVzF4AaABAg,대본 짜시는 분 대체 누구인 가요.. ㄹㅇ 천잰 듯…,jEVyN-BkRBs
UgzTRN34weYKwFJdfFF4AaABAg,"20분 전신루틴 너무좋아요...🥰 저는 순환이 잘 안되는 체질인데, 폼롤러 한번 해보니 개운한 그 맛.. 맨몸 스트레칭이랑은 차원이 다른!!! 정말 신세계더라구요ㅎㅎ 잠들기전 매일 하려고 노력중인데 실천이 쉽지않아요! 으뜸님 음성과 예쁜몸매보면 의지가 불끈솟아나요 ㅎㅎ 노력해보겠습니다💗💗💗",VVy1lU-ZspI
UgyqARk6ORqUymIWvGZ4AaABAg,"핵심 알짜배기로 이루어진 동작들이라, 아주아주 시원하고 진짜 전신이 풀리는 느낌이에요! 
매일 따라하고 싶어요:) 
으뜸님 구독하면서 항상 꾸준히 운동하는 모습도 본받게 되고, 영상도 열심히 보게되네요! 감사합니다 💙",VVy1lU-ZspI
UgzlWzoNLUgEn5VXNqB4AaABAg,"평소보다 차분한 톤의 목소리도 좋아요!
시원하게 스트레칭까지 쫙 풀어주는 전신 폼롤러 루틴 사랑합니다😍",VVy1lU-ZspI
UgysyDZAR9lTbLV5JWR4AaABAg,"헬스장에서 영상보면서 따라해봤는제
폼롤러 받치고 상체 여는 자세 너무 시원해요!!
말려있던 어깨가 펴지는 것 같아서 진짜 좋네요 ◡̈ 
영상 내내 차분한 목소리로 해주셔서 마음도 같이 차분해져요!
폼롤러 받으면 집에서도 매일 따라해보고싶네요 ~~",VVy1lU-ZspI
Ugx6_oVjD2SGy5Tvk654AaABAg,"힙으뜸님 영상나오자마자 
바로 시작했습니다! 2개월 정도 다른 운동과 병행하면서, 아침, 저녁으로 하니까 확실히 어깨가 시원하고 가볍고
다리도 전체적으로 붓기가 빠진 느낌 
종아리가 가벼운게 느껴지고!
두번째 태가 많이 달라집니다!
정말 예쁘게 되어서 기쁩니다!ㅠㅠ
처음에는 이게 효과가 있는건가 싶지만
꾸준히 1달정도 하면 정말 몸이 가벼운게 느껴지고! 효과가 있는 영상입니다 추천추천",VVy1lU-ZspI
UgzS_-JMdQGVUh5YqoV4AaABAg,"올해 다이어트를 시작하면서 운동으로 인해 뭉친 근육을 풀어주려면 폼롤러를 사용한 스트레칭이 좋더라구요 늘 으뜸님 상체, 하체마사지 영상을 보면서 진행했는데 이렇게 합쳐져서 나오다니 더 편하게 볼 수 있을 것 같아요!! 새롭게 추가된 동작과 상체에서 하체로 자연스럽게 이어지는 구성이 새롭게 느껴져서 좋아요👍 더 길어진 시간은 고통스럽지만ㅠ 제 근육이 더 잘 풀어질 수 있겠죠🥹",VVy1lU-ZspI
Ugxk_fViFqtT81MdjBJ4AaABAg,"흔들림없는 으뜸님 영상으로 모닝 홈트로 1년 넘게 도움 받고있네요~!!  너무 감사합니다~!!폼롤러를 활용한 ""재밌게 근력운동하는 영상""이런것도 만들어주세용~~~~감사합니다~~!",VVy1lU-ZspI
Ugwoy6qLmng-HDZdwHN4AaABAg,서 있는 시간이 많은 편이라 그동안 으뜸님 아침 스트레칭이나 운동 후 스트레칭 영상 잘챙겨보고 있었어요 ! 오늘 새 영상을 보니까 폼롤러를 사용해서 마사지 하는 것도 시원해보여서 따라해보고 싶어지네요 !!,VVy1lU-ZspI
UgymPCh_8iI_jjUlK5t4AaABAg,폼롤러 스트레칭이 너무 좋은 버금이입니다.  요즘 힙으뜸님 영상보며 홈트중인데 너무 좋은설명과 같이 운동해주시니 꼭 개인pt받는 느낌으로 즐겁게 운동중입니다. 전신 폼롤러는 잘없던데 꼭필요한 영상  올려주셔서 감사합니다🙇‍♀️🙇‍♀️🙇‍♀️,VVy1lU-ZspI
Ugy6F9JdVO-9oiBxpqh4AaABAg,전신 폼롤러 루틴 영상! 정말 필요했는데 올려주셔서 감사해용💓 자기 전 그리고 운동 후에 폼롤러 마사지를 해주면 뻐근했던 몸이 확실히 편안해지더라구요! 오늘부터 이 영상 보고 동작 열심히 따라해볼게요✨️,VVy1lU-ZspI
UgwQHXVGh-upIbov00x4AaABAg,"20분 전신운동 두달넘게 하고 있고 시간날때 타바타도 하고 있는데 또 새로 할게 늘어났네요
믿따뜸(믿고따라하는으뜸대장님)
..물론 운동수행능력은 한참 떨어지지만요ㅋㅋㅋ
언제나 좋은 운동 영상 고맙습니다♥︎
+20분 전신운동과 겹치는게 많네요
역시 심플이즈베스트!!",OpR9--OUark
Ugy84oq6n6E47Lvj4B54AaABAg,"스쿼트랑 런지 정석 언니꺼 꾸준히
보면서 운동하는데 자세가 천천히
잡혀가고 있어서 뿌듯한 1인😆❤️",OpR9--OUark
Ugx-tLipuJU530nmKK54AaABAg,"점심과식하고 집안일로 꽉 채우다 이제야 10분운동 업댓된거 보고 빨리 따라했어요~^^
오늘도 알차게 헥헥 끝냈어요~♡ㅋㅋㅋ",OpR9--OUark
UgwRMSnXlWlf_grvsm94AaABAg,맨몸으로 간단하게 할 수 있는 익숙한 동작이라 좋아요.😊,OpR9--OUark
Ugw854TyWcvp47OMqm54AaABAg,20분 전신 유산소 잘 하고 있는데 그마저도 귀찮거나 시간이 도저히 안나면 이거 하면 될 것 같아요! 50분 완주 못하면 자괴감 드는데 10분으로 축소라니 으뜸님 복받으세요,OpR9--OUark
UgxB_5g1BOoyKiIlReV4AaABAg,오늘 운동도 너무 좋아요💙💙,OpR9--OUark
UgzLa2qRrgeqW9OMBKl4AaABAg,버피테스트 할때만 손목이 아파서 스텝박스 이용해서 했어요! 십분만에 땀 폭발했습니다 ㅋㅋㅋㅋ 진짜 최고예요 으뜸언니 운덩 🎉❤,OpR9--OUark
Ugz79h2c3YeEMpZdqBB4AaABAg,10분인데도 이렇게 땀이 날 수 있나요 ?? 정말 홈트는 힙으뜸!!!!!! 으뜸님 운동은 하나씩 클리어할때마다 너무 기분도 좋아유 ~~😍😍,OpR9--OUark
UgxLiHG__MghD5jwZ6p4AaABAg,오늘도 좋은 운동을 알려주셔서 감사합니다🙏🏻,OpR9--OUark
Ugz5r25yy5s2dNEbZBx4AaABAg,"""봉은 조상님이 들어주냐?""
""네""",2EMdc67wfow
Ugzncjx7n4HmUOM9PfR4AaABAg,손가락 저항없이 휘는게 너무 웃겨요ㅋㅋㅋㅋ,2EMdc67wfow
Ugy7JecGvXXqBZ2KpfF4AaABAg,스쿼트 데드할때 표정 찡그리는거 왤케 기엽냐 이누님..,2EMdc67wfow
UgwuXT-IprodYb8xPXd4AaABAg,와 투핑거벤치프레스 이걸 여기서 보네요;;,2EMdc67wfow
UgzUN76ENPSt1kuAt854AaABAg,대장님 멋있음에 치이다가 벤치프레스 보고 멋있음에 기절했어요,2EMdc67wfow
UgwcGBO9UwNaEn-nMZ14AaABAg,입 앙다문거 졸귀다 진짴ㅋㅋㅋㅋ,2EMdc67wfow
Ugwh918do5uv6xKvAlx4AaABAg,밸런스 미쳤다 ㄷㄷ,2EMdc67wfow
UgxR4YIwlnvxgPN-nsx4AaABAg,ㅋㅋㅋㅋㅋㅋㅋㅋㅋㅋ자세 일부러 틀린거엿구나ㅋㅋㅋㅋ 첨에도 무릎 대놓고 움직이고 데드에서도 무릎부터 펴길래 놀랏는데,2EMdc67wfow
UgxcSYHpFkdX_Uty61J4AaABAg,스쿼트때 눈을 믿을 수 없었는데 데드 그립보고 눈치챔 ㅋㅋㅋㅋㅋㅋㅋㅋㅋㅋㅋㅋ,2EMdc67wfow
UgwySQ-Li4vvM_94gbd4AaABAg,ㅅㅂㅋㅋㅋㅋ 저게 진짜 실압근이 하면서 보다가 투핑거에서 뿜었네 ㅌㅋㅋ,2EMdc67wfow
UgzWbywJjv8rADnLuvx4AaABAg,아니 아무리 매트위라지만 안아프셔요?ㅋㅋㅋㅋㅋㅋㅋ 너무 그 어린애기들이 아빠랑 이불위에서 내쳐지기 놀이하고 웃는것같은 웃음소리에요ㅋㅋㅋㅋㅋㅋㅋㅋ 해맑음 그 자체ㅋㅋㅋㅋ,sbLBQ3XhXMo
UgzGzE0VraAsl9m0fip4AaABAg,경진이형 진짜 귀엽다..,sbLBQ3XhXMo
Ugx7FO7FLRTGCmGSe294AaABAg,겁나 가벼운 마네킹 던지는거 같네 ㅋㅋㅋㅋㅋㅋㅋㅋ,sbLBQ3XhXMo
UgwaInhgnIKloBJmhf94AaABAg,"계란님과 함께 있을때의 그 웃음과는 확연하게 차이가 납니다....ㅋㅋ 본 동영상의 웃음은 해맑은, 마음 깊은곳에서 솟아오르는 그런 웃음이군요....ㅎ",sbLBQ3XhXMo
Ugwq-VhLbe-epY1xgPx4AaABAg,남경진 선수 인성도 갑 실력도 갑 인 우리 나라 최고의 레슬링 선수~^^,sbLBQ3XhXMo
Ugzur8DoZC9m1zjvRst4AaABAg,"""원래 사람은 울기전에 웃는 법""",sbLBQ3XhXMo
UgwDpBAlW-dBYtAtOGF4AaABAg,진짜 푸근한인상에 그렇지못한 덩치 개강력하게 생겼다..,sbLBQ3XhXMo
Ugz_5IW3iM7ReO4Q36F4AaABAg,멋지게 포징하고 나서 바로 내동댕이 쳐지니까 몬가 웃기네요 ㅎㅎ,sbLBQ3XhXMo
Ugykg5EvXVt7A4b4RNp4AaABAg,둘다 만화캐릭터 같음 ㅋㅋㅋㅋ,sbLBQ3XhXMo
UgynD6yK-HVHDB5G-Qt4AaABAg,여러번봐도 진짜 사랑스럽다ㅋㅋㅋ,sbLBQ3XhXMo
Ugywd-y7pqVlrxVw6hl4AaABAg,"[힙으뜸 제작진]

원본 영상: https://youtu.be/tXzH0IVVZCE",kC8Xh6AjZEE
UgxVJVg1CVhtT1kfHlh4AaABAg,철가루 집안 ㅋㅋㅋㅋㅋㅋㅋㅋ,kC8Xh6AjZEE
UgxBip7U61oZeKlnx_h4AaABAg,"같은 값이면 싼걸 사죠 ㅋㅋㅋ(안유진 띵언) 
 5:5하자? 누가 5냐?ㅋㅋㅋ(마동석  명언)

워;;이게 뭐라고 이렇게 좋아요가 많나요;;
안유진이란분은 아이브에 소속되어있는 가수이며 리더입니다 저말이 나온건 ""뿅뿅 지구오락실(지락실)""에서 빠르게 속담 이어말하기 게임하다가 급한마음에 나온말이예요.",kC8Xh6AjZEE
Ugx61sHygoElZ01RUv14AaABAg,"모티베이션이 확 된대 ㅋㅋㅋㅋ
그 철이 그 철이야 ㅋㅋㅋㅋ 
이 집 어떡하냐고 ㅋㅋㅋ",kC8Xh6AjZEE
Ugx3sNczagOONCyAwMF4AaABAg,"댓글 미쳤네ㅋㅋㅋㅋㅋㅋㅋ
"" 역시 탈모는 유전이였군 "" ㅋㅋㅋㅋㅋ",kC8Xh6AjZEE
UgwIWbXYRI2qk1zhE4Z4AaABAg,계란 왜케 연기 잘하는뎈ㅋㅋㅌㅋㅌ 찐으로 여자혈육 있으시네,kC8Xh6AjZEE
Ugzae2nsgL5T6qy7OyN4AaABAg,검은수염 흰수염 드립 생각하신분 엄청나시네요…,kC8Xh6AjZEE
UgznBQaDdh5pLJnRg-l4AaABAg,"아버지는 검은수염티치 
아들은 흰수염 개웃기네ㅋㅋㅋ",kC8Xh6AjZEE
Ugy67Tu_apHl1t-sgCx4AaABAg,ㅋㅋㄱㄱㄱㄱㄱ뇌도 근육이세욬ㅋㅋㄱㅋ,kC8Xh6AjZEE
UgxZQGpE2rHAgGExZsx4AaABAg,"진지한 표정과 진지한 목소리에 그렇지 못한 행동과 말투와 차림새....
거기에 감탄하는 아들까지...아주 킹받는 조합이군",kC8Xh6AjZEE
UgylYhS2Wg-IqiYAe6J4AaABAg,으뜨마 아빤 엄마랑 연애할때 매력이 “철철철철철철” 넘쳤다🏋️‍♂️🏋️‍♂️🏋️‍♂️,tXzH0IVVZCE
UgwhyPNaaEfuGDm6UYh4AaABAg,"ㅋㅋㅋㅋㅋㅋ다음편엔 엄마도 나오나요? 
운동 영상도 좋지만 꽁트 넘 좋아유",tXzH0IVVZCE
Ugy7cpbuIYRCyQLEwDN4AaABAg,짱재 아버님은 철 확실하게 드셨는데요?ㅋㅋㅋㅋ 속으신 어머님 역할은 누가 나오실지 기대됩니다 ㅋㅋ,tXzH0IVVZCE
UgybO5kJHcX9uEadHgB4AaABAg,이  시리즈  진짜  좋아  ㅋㅋㅋㅋㅋㅋㅋㅋ,tXzH0IVVZCE
Ugw3MwLW58-dA3VJUQh4AaABAg,"""아직도 철 안들었냐?""
""아니 아침에도 들었는데..?""

에서 개 터짐 ㅋㅋㅋㅋㅋㅋㅋ
이게 헬 ㅊ이지",tXzH0IVVZCE
UgznyPHuGZqpIXe4ICZ4AaABAg,"이거 보다보니 중독되네.
빨리 다음 에피소드를 내놔~~
철들어 버리기 전에~!!!",tXzH0IVVZCE
UgwXDtguj7Ar2YdM3ll4AaABAg,현실감 너무 웃기네요 🤣🤣🤣🤣,tXzH0IVVZCE
Ugzl3V8Db4JMHe-u6Yp4AaABAg,아 이 콘텐츠 너무 좋다~ ㅋㅋㅋㅋㅋ,tXzH0IVVZCE
Ugx_3nNjK_AlJoU9g-B4AaABAg,으뜸님 연기력이 많이 느신거같아욬ㅋㅋㅋㅋㅋㅋㅋㅋㅋㅋㅋ 이 컨텐츠 넘 좋아요👍,tXzH0IVVZCE
UgybXMf7GTjYfa_tdnh4AaABAg,계란님과 짱재님의 연기력은 익히 알고 있었지만... 으뜸님의 재발견이 크으...,tXzH0IVVZCE
UgywMMbDbXIGOur-fYN4AaABAg,요약: 꺄아악 콜록콜록 스탑스탑 커허헣ㅋㅋ,p1kZQoDIftc
UgzjWhJg-beBxTyqS_94AaABAg,시작하자마자 잠깐만요... 개웃기네,p1kZQoDIftc
UgyWT5cNrcCCJnEFvn14AaABAg,합기도 배우던 친구한테 깔려서 발버둥치던거 생각나네.ㅠ,p1kZQoDIftc
