comment_id,comment,video_id
UgyhB0ssnQbgThqeE6t4AaABAg,"보자마자 숨이 멎었ㅠㅠㅠㅠㅠㅠ 콘서트영상 한달동안 기다렸다구요ㅠㅠㅠㅠㅠㅠ 분명 짐종국 피디님이 영상찍는걸 본것 같았는데 왜 영상이 안올라오지 하면서ㅠㅠㅠㅠ 콘서트현장 다시보니 정말 그때의 감동이 밀려와요... 여러분 김종국 노래는 라이브로 듣는게 진리입니다🔥🔥🔥 실물이 최고고 라이브가 최고... 그래서 콘서트 한번 오면 콘서트의 감동을 못 잊습니다 ㅠㅠㅠㅠ 이렇게 콘서트날 준비하는 과정도 볼 수 있게 되고 정말 좋은 세상이에요 아..... 
그리고 오빠의 벗은 등근육 정말 멋지지만 셔츠입고 노래할때 진짜 최고로 빛나는 것 같아요 💖 앞으로도 현재진행형 가수로 계속 노래해주세요!! 듣고싶을까 부른거 너무 좋았는데... 새로운 노래 더더 듣고싶어요 ❤️",WvUQ38C_-Fs
UgzVX5LkF477ODWRp7h4AaABAg,"Behind the scenes concert footage! I was up at 5:00am on a Saturday watching the concert online in my living room with several cups of tea to stay awake but as soon Mr. KJK started performing all of my sleepiness went away. I got a chance to do the video call event with Mr. KJK  at 7am. He was so sweet sounding when speaking English and such a nice guy! After saying hello and telling him I enjoyed the concert, I got extremely shy(my mind went blank😭)he immediately noticed and started asking me questions. It was an unforgettable memory!❤️",WvUQ38C_-Fs
UgwHNu4glpJvYZlmI5F4AaABAg,"I was there, and it was such a great concert !!  I just wished they were some subtitles but I still enjoyed it so much ^^ Thank you KJK !
🥰 🇨🇵",WvUQ38C_-Fs
UgxcG5FGDwH2iwIt1CF4AaABAg,짐종국도 좋지만 역시 sing종국은 힐링이죠 사랑합니다아아아~~~,WvUQ38C_-Fs
Ugwhh1bRP2-19Orm0J54AaABAg,"우리시대에는 정말좋아하던 가수
3사 대상을 받은 가수
항상 응원하는 가수^^",WvUQ38C_-Fs
Ugzjwii-uN88YBy9d7p4AaABAg,"This was such a bright and cheerful video! Kim Jong Kook was so helpful in coaching fromis_9 through this workout! His analogies are always so effective - the skewer line was brilliant! Also, the idea with the cell phone is quite a smart one to encourage you to move slowly and smoothly. While I wasn't familiar with fromis_9 before this video, they seemed really genuine, kind and hard working. I'll be sure to look out for their music! And It was really nice seeing more female guests.",XDoJL1Rg7EQ
UgxW89gY4sEFvNmtiCp4AaABAg,Didn't expect this collab to appear but it did and it's so satisfying to watch GJK teaching with passion and care to the girls. Good job everyone!,XDoJL1Rg7EQ
UgzvfNzuSKm62MHIlqV4AaABAg,"This was the perfect vlog today! Got tips for exercises I do all the time, and got to sincere/helpful discussion between one of my favorite girl groups and favorite singer <3",XDoJL1Rg7EQ
Ugys15KRMkC4rtCfNhh4AaABAg,The way Jong Kook explains and gives advice is soo clear. He has such a deep understanding of the human body and to be able to put it into laymens(simple) terms to allow others to understand is such a great skill.,XDoJL1Rg7EQ
UgwSx-I_N4NI9GQqjVd4AaABAg,"Really enjoyed this video. The girls seem really nice and sweet. They looked nervous at first, especially when he first asked them to do squats, but looked really comfortable with JK as it went on.

I found it really cute when Jisun was showing JK her stomach saying she had taped it. Also, at the end when the PD says they'd been talking for 30 minutes, usually this is a sign to stop talking and leave, but Jisun was immediately ready to keep talking. Very cute.

I'm happy the current generation of idols still know and respect KJK as a senior. The girls genuinely seemed like fans of his (music, variety shows and/or GYM). Hope to see them on this channel again, maybe in the Pilates video.",XDoJL1Rg7EQ
UgzDrWAFdiBWeWyCLKB4AaABAg,"Woah I've been following the channel since it was created but I'm loving it even more lately, can't believe as a moa/flover the two latest idol features have been with them, KJK you're such a great host and really welcoming, thank you for treating your guests so well. Gym Jongkook fighting.",XDoJL1Rg7EQ
Ugx-pOHp9uEDtZaI-GV4AaABAg,후배들과 재미있고 다정하게 토크 나누는 모습 너무 보기 좋아요!! 운동 열심히 하시는 분들이라 더 보기 재미있었던거 같아요 ㅎㅎ 더보기란에 써주신것처럼 짐종국의 가수활동도 더 많이 보고 싶습니당🥰💕 콘서트 너무 좋았는데 콘서트 브이로그 주세요....!!!!!ㅠㅠㅠㅠㅠ,XDoJL1Rg7EQ
UgyUaGCmNKL6mwdnkKZ4AaABAg,"Another lovely collab 👏👏 
I know how it felt the next day girls 😅  the soreness and all it means all your hard work is worth it 😊
Waiting for the Pilates workout vlogs haha",XDoJL1Rg7EQ
UgzL-k5KB8ElM3i-_6t4AaABAg,All the members in this group are visuals. So beautiful!,XDoJL1Rg7EQ
UgzH2Dw-iYwNOZLJQh94AaABAg,"I love the way you telling everyone about healthy lifestyle. It's straight to the point but still polite. Thank you oppa for bringing so much knowledge and as a fan love to see you regularly as a person in your youtube video. 
Stay healthy and happy 🌻",XDoJL1Rg7EQ
UgznB-ihdQ6DuCKIZlJ4AaABAg,"Watching you do the hip hinge move while working on your shoulders as well as using the cable reminded me of when I first tried doing those exercises. I’m really clumsy and accident-prone, so there was a lot of me accidentally dropping the weights or the cable slipping from my hands when tired…so glad I’ve gotten stronger and my stamina is better so that I avoid doing those things. Great video! And keep your positive mindset about marriage…it will happen when it’s the right time!",HCnDDAMDKps
UgzWZbLceR5nuT_8d7V4AaABAg,"어깨후면,등하부,윗가슴 등등 헬스인에게 평생의 숙제와 같은 부위가 몇몇 있는데 다뤄주셔서 참 감사합니다.전에 등훈련 하기 전 어깨후면을 어느정도 하라셨던 팁 잘 써먹고 있습니다",HCnDDAMDKps
UgyVn4-oJp0EeiAhUDF4AaABAg,Thank you for the tips and the variations! I've been trying to target my rear delts more often so this was super helpful!,HCnDDAMDKps
UgylTz1elzI_PD8GAfJ4AaABAg,"This was another fun, informative video! As always, Kim Jong Kook's teaching style is so clear and detailed. The Children's Day phone calls were a fun touch too. Also, Kim Jong Kook should feel confident that his work here does indeed make people happy. He balances the fitness and personal elements so well and always tailors a lot of his content to what people have mentioned in comments, making sure his audience feels heard. Especially considering how busy he is, I'm quite grateful for all the effort he puts in this channel. I'm looking forward to his upcoming concert too!",HCnDDAMDKps
UgwGo8xhYSqMP-1mT_p4AaABAg,Loved watching this video as I’ll be using all of these tips when I workout the delts. I only use dumbbells so I’ll definitely do more positioning to target certain groups.,HCnDDAMDKps
Ugw6M350T2xnsXg_Up94AaABAg,"조금전에 어깨운동하고 왔는데, 후면이 안 먹어서 찝찝했는데 승모근까지 같이 먹이는거 완전 꿀팁이네요. 집에있는 덤벨 집어서 해보니까 완전 잘먹어요~ 형님 꿀팁 진짜 감사감사",HCnDDAMDKps
UgzHcycsz40Xaruu87V4AaABAg,"I like watching you exercise. For some reason I feel satisfied, like I did my workout for the day, but I will continue to live vicariously through you. Thank you.",HCnDDAMDKps
UgyZtoWHIxp2yLkPVmN4AaABAg,"김종국형님 감사합니다!

좋은기회에 좋은 계기로
제대로 운동 시작한지 얼마 안된 초보인 저에게
어깨 후면 자극점 찾기가 어려웠는데
덕분에 자극점을 찾았습니다!

막혀있던게 뻥 뚫린것 같아서 다시 운동 재미를 찾았습니다!

정말 감사해요!",HCnDDAMDKps
UgwEjEoPaUGyCKCGYlx4AaABAg,I am such a big fan and have watched every single running man episode! I just started working out and was wondering if you could do an episode where you recommend full body workout using stretch bands of different elasticities! Much love from Singapore!,HCnDDAMDKps
UgzHO7Oqov_bvlUvfm94AaABAg,헬스장 갈까 고민하다 바로 갑니다,HCnDDAMDKps
Ugxc6nQpJvYn31o00hd4AaABAg,리원이ㅋㅋㅋ 부끄러워서 몸을 베베 꼬면서도 틈만 나면 수빈이 얼굴 쳐다보고 있는 거 너무 귀엽다ㅋㅋㅋㅋㅋㅋㅋㅋㅋ,V3SoWi19fhI
UgyfW5itfvfOSmev4jp4AaABAg,조카 너무 착해보이고 사랑많이받은 티가나네요,V3SoWi19fhI
Ugzv05UP2nCiH1Bz8nl4AaABAg,"ㅋㅋㅋ애기 되게 귀엽다 ㅋㅋㅋ
종국이 삼촌한테 반말하는것만 봐도 평상시 얼마나 잘해주는지 알 수 있네",V3SoWi19fhI
UgxiP5XqhS_Y-2heUoB4AaABAg,"Awww I like how he kept patting her back lightly to make her lass nervous 
It’s like a boyfriend and a dad that gets along really well when they first meet each other 💀💀💀💀",V3SoWi19fhI
Ugz6v_ekAypizdvblYx4AaABAg,"I admire how Leewon was composed throughout the conversation. I'm also a fan of both BTS and TXT, and I know my eyes would not have stopped leaking as soon as I'd see them in person. The whole interaction was so cute and wholesome. JONG KOOK BEST UNCLE!",V3SoWi19fhI
UgxwyafcKJdz_bWiKx14AaABAg,Leawon's sweet blush when she realized it was Soobin is just so precious! She did so good! I met one of my faves once and couldn't make a single word come out of my mouth lol Well done Uncle!,V3SoWi19fhI
UgzY-OoI8vO2z6leZ2Z4AaABAg,"Leewon is so composed and mature and I love her even more because she's a tubatu fan. She knows good music. Thumbs up for defending dad and that don't pressure him for Soobin, cuuuuute. Thanks KJK for having Soobin and promoting TXT. Their cb is May 9 and they kick off their world tour on July 2 in Seoul at Jamsil Indoor Stadium.",V3SoWi19fhI
UgzWDr6AxYalwKNVyTt4AaABAg,"조카 몸 베베 꼬는게 진짜 너무귀여워서 계속 웃으면서 봄 ㅋㅋㅋㅋㅋㅋㅋ 그와중에 팬앞에서 선배아이돌께 비지니스해야하는
아이돌의 현타 ㅋㅋㅋㅋ 너무 느껴져서 ㅋㅋㅋㅋㅋㅋㅋㅋㅋ 아 다 귀엽네요 투바투도 잘생겻네옄ㅋㅋㅋ",V3SoWi19fhI
UgyL_cLDN_yxh7N2H3l4AaABAg,"Soobin is so cute and polite, and he was so gentle with Lee Won. Jong Kook is a good uncle, what a nice gift for his niece",V3SoWi19fhI
UgwtYN-nUjrIh1ZG0Bt4AaABAg,"아빠가 성형외과 전문의,엄마는 정신과 의사,삼촌이 짐종국....? 개부럽네 ㅋㅋㅋㅋㅋ",V3SoWi19fhI
UgyGsySjAhvB5qGOiJF4AaABAg,광고도 광고답지 않게 아주아주 재미있게 탬포있게 보여주시는 이 기획력이 항상 검탄됩니다. 대단합니다.  그리고 기다리고 기다리던 콘서트 소식! 외국인에게는 좀 아직도 참가는 쉽지 않은 상황이지만 부디 김종국 콘서트를 정착화해주셔서 우리도 참여 할 수 있겠금  꾸준히 가수활동해주세요. 공연 중간 운동 팁 많이 환영합니다!!!,V02oxjKpgnI
UgwD5hBPRnhPDhRRCE14AaABAg,"자신이 쓰는 물값, 음식값, 이런거 다 아끼시는데.. 물론 할인 코드 있었겠지만, 다른 사람들 위해 이렇게 돈 쓰는 김종국은 진짜 멋있다. 자기는 겸손하고, 저번에도 그러듯이 신발 할인 아닌 신상 사라고 해주는 이런거 진짜 멋있는거 같아요",V02oxjKpgnI
UgyCxprXVywTpYe0TeZ4AaABAg,"소야님 소미님 귀여운 조카님들 삼촌사랑 많이 받는 모습 보기 좋네요.
무신사 협찬받고 기쁜 마음으로 선물 챙겨주는 따뜻한 종국님의 모습도 멋지시네요.
콘서트 소식도 들려주시고, 코로나로 닫혔던 마음들이 많이 모여서 즐겁고 친숙한 콘서트로 행복한 시간되겠네요.
좋은소식 감사해요.",V02oxjKpgnI
Ugy2JWXdK-b3bQ_5w954AaABAg,He makes them feel not embarrassed especially on the swimsuit topic..he really tries to be a an objective uncle at the same time saying that they should be   exercising..love his reaction..when they are talking with each other.,V02oxjKpgnI
UgwXfoEoYyRjQd0GTD94AaABAg,"Request: an overseas tour that doesn't just go to LA because it's on the way to the gym and visiting Mikey. Also, if a proper overseas tour were to happen, please bring Mikey, HaHa and Sechan.

Love and support from Sydney, Australia",V02oxjKpgnI
UgydOp2_ilggqVzgS1V4AaABAg,"종국이형님 형님 생신 당일날에 외쳤었지만 또 한번 외치고 싶어서 다시한번 외쳐봅니다 ""종국이형님 생신 축하드립니다 이세상에 태어나주셔서 정말 감사하고 영원히 지금 이대로만 달려나가주시길 바라고 영원히 지금보다 더 사랑합니다"" 이런말을 남긴 제 자신이 정말 자랑스럽습니다 종국이형님의 한 팬이라는 것이 종국이형님을 이렇게까지나 사랑하고 있다는 것이 저는 제 자신이 너무나도 만족스럽고 행복하고 자랑스럽습니다 비록 아무리 저 자신이라도 싫어질 때가 많지만 이럴때 만큼은 종국이형님한테 사랑을 표현하고 있을 때 만큼은 제 자신이 세상 자랑스럽고 정말 이세상이 아름다워 집니다. 그리고 종국이형님과 친밀감을 도모하는 주변 지인분들이 그리고 그런 종국이형님을 삼촌으로 두고 있는 소야,소미 누나도 정말 부럽습니다 심지어 이젠 종국이형님이 때리는 사람들도 부러워 보일 정도고 주변에 종국이형님을 싫어하는 사람들이나 형님을 향해 악플을 다는 사람들이 정말 불쌍하고 측은해 보이기까지 합니다 이렇게 가질 것 다 가졌고 이루어 낼 것 다 이루어냈고 다년간 쌓아온 업적과 선행이 수도 없이 많고 절약도 끊임없이 하고 자기관리는 물론 남들을 위해서 기부까지 지속적으로 하시는 종국이형님 형님은 그야말로 지구의 구원자? 히어로? 아니 수호신 입니다 저는 형님을 이렇게 비유하고 김종국이라는 사람을 단순히 제가 좋아하는 연예인이 아닌 이렇게 비유하고 이렇게 표현하고 이렇게 생각합니다 ""이세상에 없어서는 안될 산소보다 더 소중한 산소공급원 같은 사람, 세상에 반드시 존재해야 될 한줄기의 빛"" 이런 종국이형님을 과연 그 누가 멀리할 수 있을까요 그리고 이런 연예인을 감히 벌레만도 못한 악플러들 따위가 감히 형님의 이미지를 하락시킬 수 있을까요 절대 불가능 입니다 이미 형님의 정신력과 형님이 살아오신 험난한 세상 그 험난한 세상을 뚫고 빠져나온 사람이 종국이형님 입니다. 솔직히 형님은 교과서나 논문에 실려야 될 사람인데 진짜 형님은 주변에서 과소평가된 점이 많아서 제가 형님을 과대평과중 초과대평가를 하고 싶은 것입니다. 5월 14일에 있을 콘서트 평소엔 저도 형님을 사랑하기에 형님을 닮고 싶어서 아니 형님을 닮아서 돈 한푼 잘 안쓰는 사람이지만 형님을 눈 앞에서 마주하는데 어찌 감히 제가 돈을 아낄 수가 있겠습니까 그것도 남의 돈이 아닌 제 돈으로 형님의 콘서트에 참가하는데 형님을 바로 눈 앞에서 마주하게 되는데 어찌 제가 감히 돈을 아까워 할 수 있겠습니까 물론 소액의 돈이 아니긴 했지만 종국이형님을 눈앞에서 마주하는데 종국이형님의 실물을 보게 되는데 그깟 비용이 뭐 대수입니까 형님의 콘서트가 열리는 그날 저는 형님을 향해 형님을 향한 저의 사랑 저의 마음을 목소리로 크게 외치고 크게 표현할 것입니다. 형님 영원히 지금처럼만 잘 달려 나가주십시요 방송에 조금 거친 모습을 보여주셔도 이미 세상은 형님의 진정한 실체가 무엇인지 또 얼마나 형님이 선한 사람인지 왜 연예게에 없으면 안되는 사람인지 다 말해주고 있고 저는 이미 그걸 세상 사람들에게 모두다 설명할 수 있을 만큼 아주 잘 알고 있습니다 사랑합니다 형님 형님이 콘서트를 개최하신다면 저는 언제든지 형님을 향해 달려갈 준비가 되어있고 또 형님을 향한 이 마음 변치 않을 것입니다 아니 더 깊게 형님을 향해 파고 들어갈 것입니다 영원히 사랑합니다 종국이형님 다른 팬들이 좋아하는 것 그 이상으로 형님을 사랑하며 보이지 않는 곳에서 형님께 자그만한 힘을 실어드리고 형님만을 비추는 영원한 빛이 되겠습니다 영원히 지금 이대로만 달려 나가주십시요 영원히 형님을 사랑합니다",V02oxjKpgnI
UgwuFhCzjxO_h1ePbBt4AaABAg,"종국형님 조카님들과의 케미 ! 역시나 최고네요 !!! 오늘도 좋은 영상 & 좋은 영향력 감사드려요 ㅎㅎ 늘 지금처럼 건강하시옵고 행복하시길 바라요 !!

p.s. 종국형님 오랜만에 콘서트 감회가 남다를것 같네요 ㅠㅠ  즐겁고 행복한 콘서트가 되기를 응원해요 :)",V02oxjKpgnI
UgxpBpAt1PwsvFn6Grd4AaABAg,"They're comfortable talking any topic...it shows the bond & closeness in family & relative 🥰🥰🥰 God bless u Kookie oppa & everyone u care of. Stay safe, healthy & happy 😊",V02oxjKpgnI
UgymRmlJuOFfhTAumGB4AaABAg,"종국이형 보면 항상 주위사람들 잘 챙기시는듯
그래서 항상 좋은분들만 주위에 계시는거같아요!! 운동말고도 배울점 많은 종국이형 멋있어용👍",V02oxjKpgnI
UgyT-1S69mCpeUQdN_l4AaABAg,협찬광고를 이렇게 정성컷 해주는 유튜브채널 못봤다. 무신사는 진짜 가성비 좋은 협찬한듯.,V02oxjKpgnI
UgyQBEnQrpClAJDyvQt4AaABAg,"인생 버킷리스트 달성했습니다 🙇‍♂️

토크나 쉬는시간 없이 운동만 2시간동안.. 
좋아 죽을뻔했습니다

실제로 뵙고 함께 운동해보니 
누구보다도 운동에 진심이시라는걸 느끼고 자극 많이 받았습니다

맛있게 잘 먹었습니다! ❤️❤️❤️",gGeBtQ7hmQ4
Ugwc8YM2VgnzWcMWQqd4AaABAg,"누가 일을 쉽게 하는것처럼 보이면 그 사람이 진짜 잘하는거라고 하더니 지피티님이 바들바들 떠시는거 보니까 확 체감이 되네요. 평소 종국형님 운동하실때 보면 슉슉 쉽게 하시는것처럼 보이는데 정말 장난 아니십니다. 지피티님도 운동에 진심이신 분이고 대충 운동하신 분이 아닌데 이렇게 차이가 크다니... 20년이라는 세월 쌓아온 경험과 정립해온 자신만의 방법론, 비결들은 딱지치기로 따낸 게 아니란 말이죠. 거기에 이정도로 한분야에 대단한 지식을 가졌다면 은연중에라도 다른 사람보다 자신의 의견을 우선하게 마련인데 (보통 대가들의 말이 맞는 경우가 많기도 하지만 말이죠.) ""다른 사람의 몸은 함부로 평가할 수 있는 것이 아니다"" ""각자의 운동의 목적과 방법론이 있는 것이다""라고 겸손하게 말씀하시는 부분이 더 대단하다 느껴집니다. 운동은 헬린이인 제가 얻어갈 수 있는 수준이 아니지만 이런 마음가짐과 태도에서 더 큰 것을 얻어가네요. 감사합니다.",gGeBtQ7hmQ4
UgwXrddqE0F_Vkso1sJ4AaABAg,옆에서 끊임없이 감탄하면서 진짜 해설위원처럼 설명하는거 너무 웃기고ㅋㅋㅋㅋㅋㅋㅋㅋㅋ지금까지 한번도 김종국님이 운동할때 감탄한 사람은 많았어도 설명한 사람은 지피티가 처음인데 새삼 김종국님이 얼마나 대단한지 다시 한번 느꼈어요👍🏻,gGeBtQ7hmQ4
UgzQC3w_-iFcEmhTs154AaABAg,his reactions are priceless!! really love seeing people who enjoys lifting but also cares about technique and the science behind,gGeBtQ7hmQ4
UgwM5wligLXAZs37_EJ4AaABAg,"Worked out for the day already, but watching this vid made me get up and do 5 sets of reverse flys. You guys are so informative and motivational.

Keep up the great work.",gGeBtQ7hmQ4
Ugyzg-Wlgh50Cda_kBh4AaABAg,종국형님 간만에 운동루틴 따라와주는 사람봐서 신나신거 느껴진다 ㅋㅋㅋㅋ,gGeBtQ7hmQ4
UgzJyTpuDsWdWps1m5t4AaABAg,아는 만큼 보인다고… 지피티가 옆에서 해설해주니까 이해도 쉽고 재밌네요 ㅋㅋㅋㅋㅋㅋㅋ,gGeBtQ7hmQ4
UgwH5mcZ9LX-sI-EL954AaABAg,This was so energising! Kim Jong Kook and GPT had great chemistry and worked so well together when explaining the different exercises. It actually felt like a virtual training - both were excellent teachers and the video was just packed with different tips for every skill level. I hope they do more collaborations in the future! It's also so lovely how GPT's girlfriend came with him for the shoot and clearly supports his love for fitness. I'm really happy that he has found someone so supportive of his passion.,gGeBtQ7hmQ4
UgwrIG5rh7fGaAZNnO14AaABAg,It's really informative and fun to watch. I love GPT reactions and learn so much from his explanation. KJK is really something when it comes to working out.,gGeBtQ7hmQ4
Ugx5Dxkp7h4amztFEIN4AaABAg,동해님 옆에서 묵묵히 직관하시는 거 너무 웃곀ㅋㅋㅋㅋㅋㅋㅋㅋㅋㅋㅋㅋㅋㅋㅋ,gGeBtQ7hmQ4
UgyF0wBfOBWuyBhTTjR4AaABAg,"인사할때 포옹하며 몸만지면서
서로 근육 얼마나 컸나 보는거에
공감 100배ㅋㅋㅋㅋ",zbBKX7I4Ef0
UgxeNxOXy9PuEV4G0QV4AaABAg,진짜 둘이 서로 격하게 공감하고 서로 생각도 똑같고 습관도 똑같은거 개웃기다,zbBKX7I4Ef0
UgznucRjBKuy4dX2qgB4AaABAg,"토크가 너무 재밌어요ㅋㅋ 서로의 말에
공감되는 부분에서  텐션이 업되고 깡총 깡총 뛰는 모습이 너무 귀여우심",zbBKX7I4Ef0
UgwJPp_CIZabJk1vvVB4AaABAg,"식단이고 뭐고 가장 중요한건 김종국형님처럼 얼마나 꾸준히하느냐가 중요한것 같아요
1년전 짐종국 채널을 보고 10년만에 스쿼트부터시작해서 맨몸 헬스 덤벨사서 집에서 프리웨이트 하는중입니다.
1년동안 하고 느낀건 지방이 많이 걷어났고 여러 정보를 찾아보고 인바디도 제어보고 절망감을 느껴보기도 하였지만 꾸준함에 이젠 90kg 올챙이에서 78키로의 배에 힘을안주어도 복부가 어느정도 잡혀있는 몸이 되었습니다. 종국이형께 고맙다는말씀 드리고 다음 목표는 유산소할시간도 적고 지병때문에 지방층이 많이쌓이기때문에 복부에 중량을 걸어 크게 만들어 지방이 티가 안나게 만들생각입니다.
 정말 꾸준히하여 20년정도 이생활 유지하면서 종국이형님만큼의 제 몸이라도 좋아지면 좋겠습니다.
 고마워요 짐종국 채널 만들어주셔서요 ^^ ♡",zbBKX7I4Ef0
Ugx0s1CZoMEHt5JLeG94AaABAg,"와.... 저렇게 쉼없이 토크만 하는데도 
안 지치는거 보면 두분 다 정말 체력 엄청나신듯..ㅋㅋㅋㅋㅋㅋㅋ",zbBKX7I4Ef0
UgyRBywxYwKbOlkLLgF4AaABAg,"Had me in stitches when JK talked about being martial arts obsessed as a kid. So funny yet such a JK thing, but perhaps better (or worse, depends how you view it) all the TMI bits were hilarious to listen to. Really didn't need to know, but definitely funny the way they both talked about it. Also, apparently gym rat laugh is a thing, there's a Taiwanese youtuber who's former special forces (I think) and a gym owner who laughs pretty much the same way these two guys do. Looking forward to more JK and Kim Gye-ran collaboration, would love to see JK try out functional exercises, or even better, traditional Chinese martial arts styles like Hung Gar (think Hung Hei Gwun and Wong Fei Hung) and Bajiquan (Max Zhang in The Grandmaster) because he would be so much fun to watch turning back into a kid again.",zbBKX7I4Ef0
UgzVcy4PxnMXtAC5AGB4AaABAg,종국이형 말 준내 많아서 계란형이 끼어들 틈이 없엌ㅋㅋㅋㅋㅋ 수다력봐,zbBKX7I4Ef0
Ugy78tX5kxHH-sB1n6V4AaABAg,"이건 안볼수가 없다, 최상위 헬창들의 대화 너무나 가슴이 웅장해졌음돠",zbBKX7I4Ef0
Ugy4OvHPZ07HSsslZ7R4AaABAg,운동 덕후 둘이 만나니까 텐션 미쳤다 진짜 ㅋㅋㅋㅋㅋㅋㅋㅋㅋㅋㅋ,zbBKX7I4Ef0
UgxjbjcDU2eNROdiYUt4AaABAg,"What a fun episode. Loved hearing KJK talk about workouts with someone who loves it too! I also exercise so I can eat what I want. Wonder if they have any sparkling protein drinks where I am, curious to how that tastes",zbBKX7I4Ef0
Ugx_eKx5yxq6Uftuq3B4AaABAg,"Two episodes is not enough, I need more. Just seeing them together is the best thing ever happened to me. I once cried and felt sad while watching RM without Kwang Soo but now I am so ecstatic to see him that he is so busy with his work. Keep shining our lovely giraffe 🦒",24k7fsKLUB4
UgyHF9hGJy6oiEXoUVN4AaABAg,진짜 종국이형 같은 사람들이 헬스장 운영하면 좋겠다 바로 PT끊어서 운동 배우고 싶어...ㅠㅠㅠ 헬스 시작했는데 운동 어떻게 하는지 하나도 몰라서 항상 혼자했는데 종국이형 유튜브덕에 제가 운동을 잘못하고있다는것을 깨닫게 되네요!!! 운동 영상 자주자주 올려주세요!!!항상 보고 배워갑니다 종국이형!!!!@@종국이형 주변에 계신 맴버들 지인들 친구분들 정말 부럽습니다!!!,24k7fsKLUB4
UgzBTs2SU1TYNDutzMV4AaABAg,I missed seeing Kwangsoo and Jong Kook together. Thanks for demonstrating more at home work outs Kwangsoo! I don’t know how you do it but you’re so funny without even trying. And thanks Jong Kook for showing us more workouts while giving us tips on how to have proper form.,24k7fsKLUB4
UgwwNYVE8DeGLE18WPJ4AaABAg,its nice to see them still hanging around together ❤,24k7fsKLUB4
